reviewId,userName,content,score,app
6846f00a-fbe8-4563-a922-2f93f30d2c48,Belinda Hanson,"I rarely write reviews but this is a shocker. It just doesn't work. It constantly says ""last online *3hrs ago"" but my son is sitting next to me using it. He goes to the bathroom, I test it, search ""porn"" BANG! Pornhub videos. I want my money back.",1,Net Nanny
818f8c68-9475-467d-b79c-028d9c9bd445,Ankit Kapur,Bakwas,1,Net Nanny
b489a36b-77be-481e-ae42-825c01fde65b,Louise Cloete,Please let me know how ho cancell the annual subscription and reverse my payment.,1,Net Nanny
911be47e-d0ab-419d-b9ad-4bdf688b4401,Doss Solomon,"Does not work as suggested, it resets settings if the phone loses power. It's unreliable as it did not block adult material. Very disappointed and money wasted they should give me a refund.ðŸ˜©",1,Net Nanny
4b757b43-d452-4a3b-90b0-30045e46b7ea,B Fernandes,"Will not allow Blackboard collaborate - kids online school platform for class. Does not tell us it is blocking just blocks, took hours to figure out the problem. Only solution was removing Net Nanny.",1,Net Nanny
8bbc3859-df0c-4d34-9775-c5742babc21b,Nadia Nweke,Unfortunately I have not seen the benefit....anytime I get an alert I am not able to open the app even after I updated I have subscribed for over a year patiently hoping things will improve....please help,1,Net Nanny
885b8fd6-018c-4753-9671-84b1e51fcfb4,Eni Scotchy,Amazing!,5,Net Nanny
7f468702-195f-4490-b515-e481a4cbc0e5,Pierre Joubert,Excellent!!!,5,Net Nanny
ba3c4abd-43ae-463d-97a3-fc97f49db878,Shahar Burshtain,Super ez to hack i'm a kid and all you need to do is to force stop the app,5,Net Nanny
b9206edf-b75c-45f3-b065-bec13cca673c,Brit inCali,"It's so unreliable. It's endlessly telling the kids their time is up even though it states they've used just a few mins. So you end up turning off the rules, which defeats the object of it. The GPS positioning never works. The app generates false warnings and blocks things that are fine. Just utter garbage.",1,Net Nanny
cad6a62f-8080-41c4-bfde-70252eaee523,Joe Audet,So far so good,4,Net Nanny
4165c0d7-1712-4ec1-afab-ea176c8d0006,Kholt,This app is garbage! Never worked correctly on either of my kids phone! Waste of my money.,1,Net Nanny
d647de78-8815-46d0-86d0-109eabe794b6,Ryan Victor,"It blocks basically all websites and blocks many websites for everyone. It blocks all swimwear including swim trunks and it even mistakenly blocks some t shirts or shorts. Whatever you do, do not pay for this app. I would give it negative 5 stars but sadly, there is not an option for that.",1,Net Nanny
40078cfa-356f-470f-a32f-42b494feb8c7,Lea Insley,This app does not do what it claims to do. Tech support were unable to fix issues. Impossible to uninstall from any device. Subscription expired and I refuse to pay another annual subscription just to uninstall the app. Buyer beware!,1,Net Nanny
093120fe-8ae7-48ac-9e44-fdf95ca23967,A Google user,"Wanted to like it, struggling to see locations. App keeps shutting down Everytime I try and open it. Have to uninstall and reinstall. Very frustrating",2,Net Nanny
600c1bc1-5a62-4bfb-b4da-c0f5197596c5,A Google user,"Do not use this app if you have Google phones . After updating to NN 10 both of my kids pixel 3 phones are unusable. You can see search results but cannot open any web page. I have reached out to NN 3 times over three months with no resolution. There was no attempt to fix my issue and no follow up. I also was told that there is no refund as I was over the 14 day refund policy. I have never left a negative review for anything, but as this was such a negative experience I had no choice.",1,Net Nanny
d2cf2b4f-61d9-4e34-aa72-5e71359c531a,A Google user,I hate your app,1,Net Nanny
77ada956-dbe8-45b5-b4bc-ce2c73af61e5,A Google user,"I just had an update 2 days ago now the only thing working is location tracking and when I see when they are on their phone, but those only work sometimes. He has been on youtube and that's not showing anything. His app usage I cannot see. It does not update. It was working before and now the money I paid for it isnt worth it. Please fix this! Update: 4/11 eventually it started working. Now with a recent update on their phone I cant see anything. App usage and last used doesn't show anything.",2,Net Nanny
7b18117f-b17d-4c2d-81a0-4e6be02c5deb,A Google user,Very effective,5,Net Nanny
f5f85f38-e9bc-484c-8c0b-f7d0aee8e275,A Google user,"Very helpful app,",5,Net Nanny
ad116d3b-930d-4dd5-a591-48ee7d9be1ab,A Google user,Love the setup,5,Net Nanny
51ef9cb8-8c43-4f5c-82fd-12c2a8b84e5d,A Google user,Dont waste your money. Netnanny sucks,1,Net Nanny
f51815cb-3c6b-4c15-b018-a3cc28aae563,A Google user,Good but I haven't had it long to make a good report.,3,Net Nanny
92997c20-2471-4866-9b10-04d5d3689b44,A Google user,Very granular permissions.,5,Net Nanny
900ea9cc-74ab-4899-b2c5-3367d12da5b6,A Google user,I like the ease of changing schedules and blocking content. My one complaint is my daughter is still able to download apps like instagram to her computer even with it specifically blocked.,4,Net Nanny
716be7a6-de4d-4ec5-87a2-a5776d72d188,A Google user,Great to monitor kids addictive nature. I hope they get up and running for Chromebooks next.,4,Net Nanny
d57aaeda-239a-4d85-aeab-886ad7e3807c,A Google user,I wanted to like this app. What it was supposed to offer looked great. But the interface is terrible. I'm constantly back and forth between screens. There's no main dashboard where I can see all my kids at once. My son told me he couldn't access anything and it took me forever to find out what the reason was. I might have given it more time to understand but I'm not jumping into a 1 year plan when I had 3 days to test. Norton gave 30 days. Might have to keep looking...,2,Net Nanny
9dfd548f-5e0c-4096-b0f8-6e4d41ab1949,A Google user,"The app has great ideas and if they worked as planned would have been a great app. But it keeps failing. I have no reason why. When I called customer service to complain, I was told I can ask for a refund directly from Google play store. No offer to help fix the problem. I am still baffled from the experience with the customer service agent.",2,Net Nanny
61289c28-b11f-4c81-bd4b-c81f90fd1ec1,A Google user,"Useless!!! Dont spend the money! I paid the premium price and never recieved the services promised. After spending FAR too much time trying to get the app to work on mine and my daughter's phone, the next day she was able to delete the app rendering it USELESS!!! What is the point to this app to limit your child's phone addiction if theres no way to keep them from deleting it?!?!? -it was a pricey service that was quite misleading .",1,Net Nanny
8e088166-462f-4612-a88a-339e79a5bb7c,A Google user,Terrible doesnt work,1,Net Nanny
3f5a32c5-5378-4ef4-9888-cd3a3c154661,A Google user,An app that costs money should have less bugs and issues. It blocks functionality sporadically. My daughter can't even call me when she needs to. Very disappointing. Do not buy this app.,1,Net Nanny
a7031792-a818-470c-ba2b-8c6cdcfad481,A Google user,Sucks,1,Net Nanny
73e16b45-4665-471f-94bc-60f06929c98e,A Google user,"I wanted to log in, but the app says i have the wrong password, i tried to recover but no email was received. Yes, i have the right email. What's going on?",2,Net Nanny
7608bb11-50d2-4e13-b679-1f6a44e203c4,A Google user,It blocks the internet...but it didnt unblock it til i uninstalled everything? I head google has one i will try that,2,Net Nanny
7db8379e-85fc-436f-b815-fce64555f41c,A Google user,Garbage. Doesn't work or update unless the person you're monitoring launches their app. Support said it's a known issue and immediately issued a refund!,1,Net Nanny
cf646a42-41ef-4a49-80cc-e6d7fa0eced7,A Google user,Doesn't work well from iPhone to Samsung. Always stopping my child's phone.,1,Net Nanny
6b577024-7c34-45e5-91d5-f3df80e809ea,A Google user,"I've had this app for almost a year. It takes up a lot of space on kid's phone, doesn't send updates or alerts.",1,Net Nanny
c707e307-bdb6-458c-abe5-3f394ff51720,A Google user,"Worst app for parenting, for my child it said that he used 2 hours when he barely uses his phone. Trust me . U don't want to use this app",1,Net Nanny
8882ee42-3ef2-4e0e-b3df-a223e7b845f4,A Google user,Laggy and really crappy,2,Net Nanny
8f86b03e-c41b-4770-902b-77db0fd98c08,A Google user,I have been delighted with this product so far. Is there a trick to getting the new YouTube logging feature to work? I'm looking forward to using that.,5,Net Nanny
b2a7b1da-8555-49fa-989a-48bf8c987d98,A Google user,This app is a joke. Does not work. My child was still able to download apps and go to sites and the screen time doesn't work. If i could give zero stars I would. It also extreamly hard to get a refund.,1,Net Nanny
67583f74-4496-4df8-942a-959a0a8fff5c,A Google user,Poor customer support. I have had issues from day one of install. Tried to start a chat but either they're unavailable or the support person logs out after joining. Emailed several times with no response. Really want a refund but nobody is available to talk to about that.,1,Net Nanny
f32dfece-078a-40fd-a02e-d44f9a2db6f8,A Google user,Blocks all internet on my daughters phone all the time. I will be requesting a refund,1,Net Nanny
8c4e7d80-3971-4d38-99a2-c9f224f3207c,A Google user,Would be a good app for young kids but not tech savy kids. Finally got app working and screen time schedule to disable the internet but within 20mins our 15yro worked out he could disable the VPN and had full net access again. Disappointed that it was so easy to disable. Discovered Iphone already has a screen time lockout function which works much better and it's free. Was issued a refund.,1,Net Nanny
8129dd39-64bc-4ff2-b0da-a7c902592f7b,A Google user,Couldn't setup on my daughters iPad,1,Net Nanny
ffa85bea-4b6f-454a-bbf5-c3c4e753152d,A Google user,"This app, in combination with the children's app was barely functional. It is incredibly easy to get around and the app crashes too often to be effective. The children's app hasn't even booted on my child's phone for months and the administration protections (eg password lock and wifi logins) stopped working entirely. In addition, the customer service did not address or help the issues. After promises to help me out, I have not heard anything. I recommend against this app.",1,Net Nanny
43361037-efaa-4bbf-9e03-da6fe7036095,A Google user,"I purchased the subscription and have been using the app to manage one of my kids devices and it's not working right. The limits I place do not take effect and it will lock the internet and pause the device during usage time. Not sure what else to do about this or how to fix the problem. I've tried rebooting, uninstalling and reinstalling.. Any help would be useful.",3,Net Nanny
8883e249-26cf-4247-8e37-bf5de8b5b384,A Google user,"The best thing about this app is that once the schedule is set, it is the app that controls the phone, not the parent or the child. Adding the 3rd party is brilliant.",5,Net Nanny
ba4a8538-d1a6-4f0b-af0c-21b0ee37ecd2,A Google user,The app works great for managing my kids devices. Wish List Item: I wish it would allow me to set up a time limit per day so the kids aren't locked into a schedule.,5,Net Nanny
7e1afd78-d4f3-42bd-9e43-a475390a9e68,A Google user,It's simple and easy to use and helps my wife and I teach our sons responsible use of technology! Would love to have a few more features but the current ones work well!,5,Net Nanny
99920592-b812-468a-8575-4d74ab134b3c,A Google user,So glad I stumbled upon this app! I never allowed my son to have phone because I didn't want him to let it rule his life. Then I found this app! He is one happy boy!!,5,Net Nanny
ad6c6197-8afb-434b-a8c7-90dc81ba195f,A Google user,"Works good on Samsung products, didnâ€™t work on android. I have paid for premium, would like individual time limits for each app if possible.",5,Net Nanny
6162af2a-8efb-4ce6-9b1c-00e43ffaa696,A Google user,This app is great- haven't used it that long yet but so far I'm loving it! My daughter is definitely an Tablet abuser and this is a great way to control her use of it!,5,Net Nanny
2fa322a0-60c6-4ef9-88c8-511aee81d0e9,A Google user,Love it it set bedtime and my son came running upstairs saying mom something happened my Samsung broke he has no idea I can control what he has access to !!!! Awesome app,5,Net Nanny
576c71fb-8e35-4794-a841-a63a8e1f0958,A Google user,This app is proving to be very effective in helping to control our kids phone activity. It's also useful in getting them to do their chores when you want them done.,5,Net Nanny
2a20f5a9-b54f-45bc-af01-6bbbbf9bad89,A Google user,"My sons donâ€™t have phones yet, but it would be nice to limit there tablet time!! They have the amazon fire! I love the idea, I just wish it worked on more devices!",5,Net Nanny
9d74803d-7d7d-41c3-b6b0-e21907c48558,A Google user,So far so good. I have only used it a few days but seems to do the job I want it to do. I have no complaints. It's easy to use and I can control it from my phone or Tablet.,5,Net Nanny
3027429f-53c4-412d-85b2-220c22d29133,A Google user,"Kids ignore us? We shut them down and they come running to us. On the road? Shut them down, they can only call you, to beg you to turn their phone on! Awesome!",5,Net Nanny
dff26fd7-6266-4fd7-b894-0d3b8c9b0e2f,A Google user,"A great way to teach your little ones responsibility with their devices. You can alter, edit and change their usage from your device with ease. I LOVE IT!",5,Net Nanny
eed33acf-31f8-4549-9c83-0f7e8c44a9ed,A Google user,I set up a 12 hour session to block access to apps and I literally have to find other productive things to do rather than spending time with phone.,5,Net Nanny
e5d1de41-6650-4597-a38f-0b525e4f497f,A Google user,"A perfect app for letting me get back in control of the kids' screen time. No more arguments and fussing. Homework, chores , family time - check , check and check !",5,Net Nanny
091fec20-928b-48ba-b29a-a77d6749862e,A Google user,I've said for years it would be nice to have a way to control kids electronic devices on demand without having to unplug the home wifi. Super easy and the mom nag has ceased!,5,Net Nanny
6f35ed21-1911-4413-8d36-d8b5f156c248,A Google user,I love that you can setup screen time and they pause and resume in their own! They now control their time within my set schedule. Very tuff to setup but worth it.,5,Net Nanny
234a2a87-21a9-44fb-9b40-807988833c30,A Google user,Great app and free!! Allows amazing control over my kids Tablet time. Now if they only made a companion app to stop my kids from crying when their games get shut off! Lol,5,Net Nanny
005089bb-9bb6-4020-a317-406991087a25,A Google user,"I watch several of my grandchildren and with the app, my grandson has the same rules for screen time at MomMom's as he does when he is at home!",5,Net Nanny
037e78ef-bae1-47f3-aa4b-498428ddf451,A Google user,"I wish that it worked on our very old Tablet too, be all the newer devices in our house are connected. Its not overly complicated and it works as advertised. Thanks!",5,Net Nanny
63b68c03-7c3a-4b62-a451-78d7852f7609,A Google user,"I found this app months ago and love it. It is easy to configure and use, and gives my daughters just the right amount of restriction to allow them to manage their device use.",5,Net Nanny
297f0440-9637-4cbd-90ed-9d63871cafdd,A Google user,My kid was able to delete the app from her phone and I didn't know! From my end it seemed like I was still controlling screen time. This is a pointless app. Waste of time.... I'll keep looking,1,Net Nanny
39eda362-63e9-41fa-99b6-b3a875c45a3e,A Google user,Went to sigh up and all I GET IS unknown error,1,Net Nanny
b45f939f-b4ee-499a-960f-01ff673756c8,A Google user,Misleading download. When you find the app in the play store it has a free download button. No where in the app description does it state that there is only a 3 day free trial before you have to pay to subscribe. Once downloading it still took me some digging to find out how much the subscription would actually cost! Have deleted it already so I've no idea of the quality of the app,3,Net Nanny
d2d9178c-eeb3-48e5-91ab-240cfef0edad,A Google user,Terrible. Was sitting right next to my daughter's phone and had no control even with a total block.,1,Net Nanny
847167a3-d244-48ce-9e4d-98c4f9fe6597,A Google user,"Hello, I have now contacted you twice with no response. Could you please respond to my question with a solution or refund me the subscription as this app is not providing the service I was sold.",1,Net Nanny
ba836ba2-38ed-40df-b054-75579e19ca2d,A Google user,This thing is bad,1,Net Nanny
6d5df8ee-3237-4436-b28b-16d8020a1b7f,A Google user,No way,1,Net Nanny
440a7c1c-d299-4392-b887-d79ca71e04aa,A Google user,"Installed on Android and iPhone (parents). Installed and configured on Windows 10 laptop and iPad (child). Worked on iPad for a week then did nothing. Worked on laptop for 2 weeks then laptop would not work. Spent hours with support and trying to uninstall, reinstall. I've worked as I.T. developer for 30 years, and could not get it to work on either device. When it did work, the iPhone app would not update screen time. Finally asked for a refund and was reimbursed.",2,Net Nanny
c3651a81-7510-4b56-ae1f-52129f50ab5d,A Google user,Way too expensive,1,Net Nanny
0851c200-cd80-4de8-a046-73a6816d633f,A Google user,I sucks booty hole and doesn't work it is complete trash and you are probably a crappy overprotective parent and this is how I feel about itðŸ˜‘ðŸ˜‘ðŸ˜¤ðŸ˜‘ðŸ˜¤ðŸ˜¤ðŸ˜‘ðŸ˜‘ðŸ˜‘ðŸ˜‘ðŸ˜‘ðŸ˜‘ðŸ˜‘ðŸ˜‘ðŸ˜‘ðŸ˜‘ðŸ˜‘ðŸ˜‘ðŸ˜‘ðŸ˜‘ðŸ˜‘ðŸ˜‘ðŸ˜‘ðŸ˜‘ðŸ˜‘ðŸ˜‘,1,Net Nanny
adb0d63f-3e3a-46f5-a832-b50f72b67fb6,A Google user,It makes u pay for the app it isnt free so u shouldnt advertise it as free,1,Net Nanny
0dd94d50-4c05-413b-82e9-f410a13a036b,A Google user,"Easy for the child to delete, terrible support, if they reply it's a one liner. They are completely uninterested in resolving problems and just ignore emails. I asked for a refund as its so easy to delete, no reply. Stay away!",1,Net Nanny
65c653c9-9e8b-4038-9616-bb204e453652,A Google user,"Buyer beware, If you purchase the yearly subscription and try to cancel you will not get any reimbursement for it. You will get told someone else will have to do the reimbursement.",1,Net Nanny
6f227b10-c9e8-427f-aea0-244a1ca14f2e,A Google user,"Can't monitor PC client, just mobile.",2,Net Nanny
2e6f429d-9dc7-4b3a-9bd1-8c5e413b8606,A Google user,Meh. Location service doesn't update well (better to just use Google location sharing). Other features no better than Qustodio.,3,Net Nanny
c834a631-d64c-4499-8a54-4579de6ca9d3,A Google user,"If I knew this app would be so glitchy I would have saved myself $55. I'm using it on my kids' tablets since they don't have cell phones yet. I'll set it to standard on my phone and the kids still have no access to their device. UPDATE: Despite the problems I had with the app, I have to commend their customer service. They were great both when I called and with email.",2,Net Nanny
616ad24c-26a6-410a-a27f-f5804ef979ac,A Google user,Fix your dam app cuz it blocks whatever it wants it sucks ass fix it,1,Net Nanny
cdb5d0f4-5728-42c2-8b47-dac6a447abb3,A Google user,"Misleading review score. Looking at the last 12 months you'll see only 1 or 2 stars ratings. Indeed this app is useless. You get 3 days trial which is nothing to understand the capabilities of the app, I then bought it for 55USD for a year (no wonder why they don't have shorter periods, they want to take whatever they can before you cancel the subscription), I then discovered that the app lack basic capabilities, like what apps will be functional during the OFF time. The overall controls are very limited. The customer support is not to helpful, and they did not give a refund. There are much better apps there like screen time, for example.",1,Net Nanny
32668d66-1ea7-4e0d-b459-5a1fbead971b,A Google user,"Let me cancel my account. ""By next business day"" is a bunch of bull. Poor customer service. Update: It's been a week since my first email, and 5 days since they responded here to my review. Nothing. I've sent 2 emails, and I get the automated ""next business day"" response and nothing else. I have screenshots that prove I emailed you on the 3rd and the 8th. You did refund me on the 9th, but that does not change the poor customer service I recieved.",1,Net Nanny
44ba9327-d467-4388-8d8e-075270846c16,A Google user,"Frequently doesn't work, won't be renewing",2,Net Nanny
00b39fe9-8466-44d9-b79d-a64c83325ce4,A Google user,"The concept is good. The execution lacks energy. It was glitchy with iPhone and the billing is redundant and impossible to rectify. If you're careful with your subscription and only use Android, you may have a better experience. A smooth operating version of this concept is needed in this era of parenting. I hope someone will figure it out.",2,Net Nanny
d4575462-cf6e-469a-9873-62b8b2d7b502,A Google user,Doesn't work. Several emails back and forth. The money definitely got paid.... the app didn't change after trial. Still asking if I want to upgrade. UPDATE.... No refunds after you pay over $50 for this app. Again IT DOES NOT WORK. Please DO NOT WASTE your time or MONEY on this app. You can email them back and forth all you want but NOTHING IS CHANGED OR REFUNDED.,1,Net Nanny
a34ee11b-d1fc-4de5-a730-ad1ba28bf4a3,A Google user,Impeccable! Itâ€™s obvious that everyone will fall in love with this app due to different outstanding features it has.,5,Net Nanny
90798f89-6bc9-4266-a52d-0e855e5a3ecd,A Google user,"Youâ€™ll have complete control over the settings that will guide the monitoring, and appropriate filtering, of your kidsâ€™ devices.",5,Net Nanny
b47f9796-c3dd-46ce-8c70-0ab26288e5bc,A Google user,"Deserve 5 stars. Having it installed, you will discover more interesting things beyond your expectation.",5,Net Nanny
2b004c52-2921-4fbc-ad5b-1a5a2eeea928,A Google user,Worth experiencing! Net Nany never lets you down. Have it installed right now.,5,Net Nanny
c68aea8c-ffa6-4116-be7e-62a84f00bd8e,A Google user,Wonderful! Net Nanny is suitable for everyone. Try using it. Really nice.,5,Net Nanny
e9f423f8-7f3f-4ba2-850c-9fc185f6df6a,A Google user,I have recommended it to all of my friends and many of them rate this app 5 stars.,5,Net Nanny
f1b57beb-9780-4544-9e81-fe8013c19b23,A Google user,Awesome!!! This app is exactly for any parents trying to gain a better control of their kids.,5,Net Nanny
ec398184-ab7f-4804-96af-264a0e702ad3,A Google user,Out of this world! No words can show how wonderful this app is. Thanks a lot.,5,Net Nanny
b8c8d9c1-f007-499a-bbdc-90a2901600da,A Google user,"Net Nanny allows parents to know, and then allow or block, the apps their child has downloaded on their device.",5,Net Nanny
d06f1658-4893-47e1-8d52-ec275b23aa0c,A Google user,"From your phone, Net Nanny enables you to turn off the Internet instantly so you can get your kids' attention and limit screen time.",5,Net Nanny
6a675848-e321-45c2-9089-1bcd554d4df6,A Google user,"Iâ€™m really impressed by the usefulness of this app. With Net Nanny, you can view each childâ€™s location with a Family Map.",5,Net Nanny
980377a8-b82b-4fd2-a19c-e5dad19d3743,A Google user,"Flawless ! With Net Nanny, you can be sure you have the best protection available to shield your kids from online dangers.",5,Net Nanny
32916b71-d2a7-4bce-a7fb-247fc6d81249,A Google user,I really enjoy this app since one of my friends introduced it to me. Thanks a lot.,5,Net Nanny
6d02db92-9525-4b99-927a-a38037fe7e7b,A Google user,"I don't install many apps like this on my devices, but Net Nanny is my all time favorite so far.",5,Net Nanny
65a58e67-af1d-4dbf-9734-20e42ce4ea77,A Google user,"Amazing ! With Net Nanny, you can be sure you have the best protection available to shield your kids from online dangers.",5,Net Nanny
5281cacc-6840-4307-b18a-d1659f8abd05,A Google user,Best app ever. Nothing to regret when you have it installed on your phone. Do it right now.,5,Net Nanny
1b87f53e-c3d9-4261-8fff-0bfb3950b743,A Google user,It is indispensable for any parents. Net Nanny gives parents the ability to adjust screen time limits and allowances instantly.,5,Net Nanny
ca220022-b38c-4f26-9d35-ab73d4b7c998,A Google user,.Wonderful ! Net Nanny lets parents see the daily total of each childâ€™s screen time.,5,Net Nanny
1256aec9-bafd-44d8-a2d4-cb372bf47937,A Google user,"Perfect!! With this app, you can protect your children from online dangers.",5,Net Nanny
8ff53065-01e5-4a66-9473-4e67ad5879f9,A Google user,"STAY AWAY! Scam! I bought the membership for a computer it didn't block anything, immediately I wrote an email for a refund and there was no answer. STAY AWAY FROM THESE SCAMMERS!!!",1,Net Nanny
6d9f2a66-dbdb-4ece-a742-1b863a897901,A Google user,"I am constantly having issues with this app. Tech support is not helpful. I have to call multiple times to get issues ""fixed"". would not recommend",1,Net Nanny
8b85b9b3-a826-44fa-9d79-ad41c7092d99,A Google user,I purchased this app and it doesn't even work. DO NOT GET IT!!,1,Net Nanny
3a529d59-a1d2-458f-96c0-a99bca9f7930,A Google user,Thank you very much. I have been using this application for a while and I am getting more and more aware of my child by observing its activities on the phone.,5,Net Nanny
5759696d-f52e-4454-9d42-1dbf210dbfbe,A Google user,"They always complain that the bigger their children are, the harder it is to control. Net Nanny will help them. I will definitely recommend this app",5,Net Nanny
ec53402d-3237-4f3f-958f-6d6f1ada6cfc,A Google user,We use it to set time limits on child's phone & computer access. Works great for us. We love it.,5,Net Nanny
