reviewId,userName,content,score,app
4eeec05e-3b54-41b2-a78f-8589e124db15,Andre Hermawan,The app looks simple with some feafures. Need to fix the issue that request is not shown in the app (i have to approve in browser),3,Kaspersky SafeKids
9b3b9e95-4e2d-4656-b577-588dcdd1522d,darkskyvision,Govno a ne prilojenie,1,Kaspersky SafeKids
ef19c84e-6ce7-43af-923f-af5105a71827,Imran Ridwan,This is the worst it is always faulty I tried reinstalling it but it is still faulty and I am on the latest phone,1,Kaspersky SafeKids
90ecde09-07fd-4104-a408-c3bc4cabb993,Calvin Pyami,"It's very secure and once I learn how to work with it, it's works great",5,Kaspersky SafeKids
461f77d9-530d-4dea-b53a-2fe2b967bfe7,mohammed mafaz,Great application easy to access,5,Kaspersky SafeKids
9df176f9-45a7-43e9-9789-b2e73dee29cd,megan edwards,It would be great to not have to open the browser for some of the settings.,4,Kaspersky SafeKids
67d0cd9d-2528-4ad5-a898-dcede59b169d,Chong Jin Hor,Reliable,5,Kaspersky SafeKids
72e23050-78de-44f4-a8dd-cd5280c8fc37,Harris Tan,"the app is messy and buggy. when the child request for time , the notification isnt pushed to the parents device or email. wouldnt recommend.",1,Kaspersky SafeKids
cedadd44-abcb-4db8-a23b-b3ca7788acad,Sorica Niemand,Best app for kids and teenagers,5,Kaspersky SafeKids
5ff2348a-fb63-4440-8b12-a2ecdeaab3b1,Massimiliano Montelatici,"I'm completely relying on SafeKids, stressing it weekly with strict and specific usage rules that change frequently over my son behaviour. So far he wasn't able to disable or workaround to it. There are some small bugs and limitations but I still chose this over the others.",4,Kaspersky SafeKids
da463f35-8612-4379-b810-68fd3f5eff11,Lauren Joanne Lister,"I set all app access and settings and everything was working last year BUT in the past few months, there have been frustrating glitches. My child had access to apps I'd allowed but then the app kept revoking access on its own. When they try to request permissions from their device, there is no request coming to my device. I have submitted an issue via the app but nothing has been fixed. I am not impressed and will probably cancel if this isn't sorted out within the next few days.",1,Kaspersky SafeKids
3e2d13d7-09a8-4b30-8f9c-bb1daf03915b,Jacob Heisler,Does not work. App behaves erratically.,1,Kaspersky SafeKids
2fa88315-641d-49a5-a81a-2e423312e357,Lorah McCorriston,"I think its great! Easy to maneuver, edit and of course monitor. Worth every penny.",5,Kaspersky SafeKids
1afe340b-dfb0-4c45-9f0e-a4fc2ad32713,Elie Atmeh,good for the money,5,Kaspersky SafeKids
8895a407-9a11-455a-8776-b17d167536b5,CÄƒtÄƒlin-Mihai Caminschi,Excellent!,5,Kaspersky SafeKids
acd68496-5439-4c1e-975b-6923e0a72ca5,Krasimir Kazakov,"I will have to rate it down to 1 star. Even though I still pay it, SafeKids does not see ""Google"" app and I can't block it. Therefore, my kid can use it outside of allowed hours. Wrote to support few months back, but nothing changed so far. This is a easy and serious breach. P.P. Contacted you again, but got an automated message that my case is already closed. That's fun.",1,Kaspersky SafeKids
29d3487e-57bc-4e0f-ac7a-d00addab0894,daninthepan,"When the battery runs low and the battery optimizer kicks in, it overrides Kaspersky leaving the phone completely unlocked. (Huawei P20). Also it seems unable to block Google at any time",2,Kaspersky SafeKids
6f4ab6b6-6eaa-4f27-bbf4-3845225cda7f,Bahtiar Akrov,"Sometime unable show apps filter, need to uninstall then installed again, in ios never happen that bugs",2,Kaspersky SafeKids
4a6fdef2-73fb-4ee2-ac33-169f30354aca,Ø®Ø§Ù„Ø¯ Ø§Ù„Ø¬Ù‡Ø¶Ù…ÙŠ,Excellent,5,Kaspersky SafeKids
2213b0e6-aa09-4cf0-a536-bdff9b12b078,Shelley Brown,"Rubbish, cannot monitor anything worthwhile on my daughters iPhone, sky buddy much better when available. So called large software houses trying to protect our children rubbish!",1,Kaspersky SafeKids
3b12a3dd-f08f-4ba5-8a3b-99aad01ddd7f,Jakob Thusgaard,"For the nth time had to setup time limits and allowed apps AGAIN. Kaspersky Safe Kids routinely resets settings. App updates seem like a culprit. After the Safe Kids app updates, often important app settings will have disappeared, requiring reconfiguration. Would be a good app if it would work consistently - but it just does not.",1,Kaspersky SafeKids
251f063c-94f0-46ce-99b4-57f229ca653b,Mohammed Al-Hahsmei,Bad,1,Kaspersky SafeKids
28fdcb79-c053-47f3-9e61-7ad53d39bed8,Ganesh .K,Good app for safety of kids,5,Kaspersky SafeKids
b7b30989-710d-42f4-9c27-02228781cbcc,Chinedu Dike,Fantastic App to control what the children are exposed to. This is absolutely good!,5,Kaspersky SafeKids
dcd95de1-7eed-4a8d-9a82-eb7348b8667e,Ð˜Ð²Ð°Ð½ Ð¨ÑƒÐ¼ÐºÐ¾Ð²,You need to add combined screen time for one or more devices.,4,Kaspersky SafeKids
661f10ee-ae9f-4571-9385-2e690befebd3,Anuj Sharma,good,5,Kaspersky SafeKids
22276212-9366-4c0c-a78c-cbb232ef78a8,Adam Watts,"This app was good but when you no longer need it, it's impossible to cancel the subscription. I have also tried contacting you directly via email but have not received a response and continue to charge me Â£4.99 a month for a service I no longer use.",1,Kaspersky SafeKids
8d4d7697-efba-4514-911c-0999541273f1,Taha I,"I have a premium membership and this app really helps me monitor my kids. Im aware 90% of the time of what they are doing. 10% of the times you have to keep an eye on them because some pirated movie or adult gaming sites are not blocked automatically so they have to be checked on and off on PC. Rest of the times, I am at ease. Thank you Kaspersky Safe Kids.",4,Kaspersky SafeKids
020268d8-a133-42a3-ba8d-5342d818e38c,Avishay Patoka,"5 stars BUT, if there's a developer here then this features are missing : 1. Let me choose the first day of the week because i'm having different week and weekend days in my country. 2. I'd like to choose between an overall allowed time to all devices belongs to a specific kid or seperate time for each device. 3. Add time to a kid from parent's device. 4. Let me choose if an allowed app (even if the device is blocked) should be consider in the allowed time or not be counted in the allowed time.",5,Kaspersky SafeKids
b16ec3da-e106-42de-8eee-6fc3294caf95,Pootis Spencer,ÐÐµÑ€Ð°Ð±Ð¾Ñ‡Ð¸Ð¹ ÐºÑƒÑÐ¾Ðº Ð“ Ð¾Ñ‚ ÐºÑ€Ð¸Ð²Ð¾Ñ€ÑƒÐºÐ¸Ñ… Ð¿Ñ€Ð¾Ð³Ñ€Ð°Ð¼Ð¼Ð¸ÑÑ‚Ð¾Ð²,1,Kaspersky SafeKids
f3bab030-e174-4bb3-b150-e1ba7f978ccd,Newuser Ac200,Safekids by kaspersky has helped me keep my devices safe and everyone safe.,5,Kaspersky SafeKids
04e07767-bc5f-49ed-9cb0-54dd62f49981,SaÃºl E. (Goodspeed),Easy and powerfully best parental app so far for mi kids,5,Kaspersky SafeKids
bbefed26-2dbd-4ce0-899d-5100404acc9d,Ð¡Ð°Ð½Ñ ÐœÐ°Ð»Ð¾Ð¹,Ð¡Ð°Ð¼Ð¾Ðµ Ð»ÑƒÑ‡ÑˆÐµÐµ Ð¿Ñ€Ð¸Ð»Ð¾Ð¶ÐµÐ½Ð¸Ðµ Ð² Ð¼Ð¸Ñ€Ðµ,5,Kaspersky SafeKids
7fe4d42b-e8b0-4c0f-8e56-01bf567341a5,StreetRacerONE,"App lÃ¤sst sich nicht deinstallieren Zum 3.x wurde meine Whitelist gelÃ¶scht StÃ¤ndig hat man nur unnÃ¶tigen Ã„rger damit, dass auf Ã¤lteren, anderen Smartphones manche Funktionen net gehen & bei neueren Modell funktioniert dann auch wieder irgendwas net. Versteh' auch net warum der Bildschirmhintergrund komplett weiÃŸ wird, wenn man die Benachrichtigungsleiste runterzieht. IST DAS EUER ERNST??!!",2,Kaspersky SafeKids
f5429391-d0b8-4259-b17a-1932ad62483f,Mohammed Ajmi,Serves basic purpose os monito time,4,Kaspersky SafeKids
1ad054eb-6e7a-4305-8bd4-bfc56d2f7cf7,Evgeniy Timofeev,"ÐŸÐ¾Ñ‡ÐµÐ¼Ñƒ Ñ€ÐµÐ±Ñ‘Ð½ÐºÑƒ ÑƒÐ´Ð°Ñ‘Ñ‚ÑÑ Ð¾Ð±Ñ…Ð¾Ð´Ð¸Ñ‚ÑŒ Ð¾Ð³Ñ€Ð°Ð½Ð¸Ñ‡ÐµÐ½Ð¸Ñ? Ð ÐµÐ±Ñ‘Ð½Ð¾Ðº Ð¿Ñ€Ð¾ÑÑ‚Ð¾ Ð¿ÐµÑ€ÐµÐ²Ð¾Ð´Ð¸Ñ‚ ÑÐ¼Ð°Ñ€Ñ‚Ñ„Ð¾Ð½ Ð² Ñ€ÐµÐ¶Ð¸Ð¼ ÑÐºÐ¾Ð½Ð¾Ð¼Ð¸Ð¸ ÑÐ½ÐµÑ€Ð³Ð¸Ð¸ Ð¸ ÐšÐ°ÑÐ¿ÐµÑ€ÑÐºÐ¸Ð¹ Ð½Ðµ Ð²Ð¸Ð´Ð¸Ñ‚, Ñ‡Ñ‚Ð¾ Ñ€ÐµÐ±Ñ‘Ð½Ð¾Ðº Ð¸ÑÐ¿Ð¾Ð»ÑŒÐ·ÑƒÐµÑ‚ ÑÐ¼Ð°Ñ€Ñ‚Ñ„Ð¾Ð½, Ð¸Ð³Ñ€Ð°ÐµÑ‚ Ð² Ð¸Ð³Ñ€Ñ‹...",3,Kaspersky SafeKids
668f67ff-51a5-462c-8337-545ff8f37ca1,Abu tahirul Wasim,Dear community this app is parfect for safe kids but always show the Icon on display is worst.and when it enable I cannot open my settings,5,Kaspersky SafeKids
c89ba8fe-714a-4677-a8e0-c508259f377a,David Ridley,Best app for controlling kids devices. Go premium!,5,Kaspersky SafeKids
1ace0845-6cb2-4b51-b843-d9a349fe023a,smiljko S,"It was stable and good application until couple days ago... Now, when I change limit time in app nothing happens to devices controled by the app. Edit: I cretaed another children profile in the app, and everything works.",4,Kaspersky SafeKids
574dcf40-da8a-473b-b40b-41e097ab65f2,AlexTurboG,"Ð Ð°Ð±Ð¾Ñ‚Ð¸ Ð´Ð¾Ð±Ñ€Ðµ, Ð½Ð¾ Ð½Ð° Ð´ÐµÑ†Ð°Ñ‚Ð° Ð½Ðµ Ð¸Ð¼ Ñ…Ð°Ñ€ÐµÑÐ²Ð°",1,Kaspersky SafeKids
2161e8d8-0329-4fc0-9746-7357c3024ad2,moonwine,"DO NOT INSTALL Installed on my child's device, we changed the phone, and I can't remove it from the old one. Kaspersky people try to ask ""what is wrong"" or want more details, although already given to them. THIS APP CAN'T BE REMOVED. Kaspersky's instructions are to click the icon, select uninstall and insert the password. Well, there are no uninstall options, and this USELESS app took over; it can't be stopped or else. Kaspersky should find a solution instead of faking information requests.",1,Kaspersky SafeKids
c85b3141-0552-4dff-8c4b-8ab92b5ec5f8,Vinod P,"The app is not user friendly at all, need simple design and lay out. Need to change the UI to somewhat user-friendly.",1,Kaspersky SafeKids
cac186f1-fa79-450f-a34c-1e01a954e6f0,mysoc Soc,My kid can pypass the time limitation set,2,Kaspersky SafeKids
25a0424e-b462-45bb-a180-2614820e1ab2,Max P,Not perfect but does what it says it will do very well. At a very sensible price.,5,Kaspersky SafeKids
a353be14-e17d-4669-9a31-534fc66e5679,Rob Verdu,no good,1,Kaspersky SafeKids
fe4f4b98-3fa0-4dfa-93d0-6a60b08060aa,Anton Kopilov,Good one,5,Kaspersky SafeKids
d736a419-33ad-437a-8d2b-6f1a154a3ed8,Daniel K,Great app well done,5,Kaspersky SafeKids
bc0e1266-b0bb-4f13-9be1-bc621e174bfe,E,This application is annoying when its active and is incredibly easy to disactivate.,1,Kaspersky SafeKids
76080c0a-3848-4f77-9322-04bb1dc1b775,Dr.MAYUR HIRPARA,I want to uninstall the but unable to uninstall so I need your guidance,1,Kaspersky SafeKids
79145fde-6dc7-45e8-8d04-2d1b3bddafc5,Nik Prilutskiy,"Ð˜Ð· Ð¿Ð¾Ð¶ÐµÐ»Ð°Ð½Ð¸Ð¹: Ð½Ðµ Ñ…Ð²Ð°Ñ‚Ð°ÐµÑ‚ ÐºÐ½Ð¾Ð¿ÐºÐ¸ Ð¼Ð³Ð½Ð¾Ð²ÐµÐ½Ð½Ð¾Ð¹ Ð±Ð»Ð¾ÐºÐ¸Ñ€Ð¾Ð²ÐºÐ¸, Ð²Ð¾-Ð²Ñ‚Ð¾Ñ€Ñ‹Ñ… Ð¿Ð¾Ñ‡ÐµÐ¼Ñƒ Ð·Ð°Ð¿Ñ€Ð¾Ñ Ñ€Ð°Ð·Ñ€ÐµÑˆÐµÐ½Ð¸Ñ Ð²Ñ‹Ð³Ð»ÑÐ´Ð¸Ñ‚ Ñ‚Ð°Ðº ÑƒÐ½Ñ‹Ð»Ð¾ ? ÐœÐ¾Ð¶Ð½Ð¾ Ð¶Ðµ ÑÐ´ÐµÐ»Ð°Ñ‚ÑŒ ÑÑ‚Ð¾ Ð½Ðµ Ð¿Ñ€Ð¾ÑÑ‚Ð¾ Ñ‚ÐµÐºÑÑ‚Ð¾Ð¼ Ð½Ð° Ð±ÐµÐ»Ð¾Ð¼ Ñ„Ð¾Ð½Ðµ, Ð° ÑÑ€ÐºÐ¾Ð¹ ÐºÐ½Ð¾Ð¿ÐºÐ¾Ð¹ ÐÐµ Ð²ÑÐµ Ð² 4-5 Ð»ÐµÑ‚ ÑƒÐ¼ÐµÑŽÑ‚ Ñ‡Ð¸Ñ‚Ð°Ñ‚ÑŒ Ð²Ð¾Ð¾Ð±Ñ‰Ðµ Ñ‚Ð¾. Ð’Ñ‹ Ð½Ðµ Ð¿Ð¾Ð´ÑƒÐ¼Ð°Ð»Ð¸ ?",3,Kaspersky SafeKids
fffc7600-3418-48a8-b75b-8960f6527b1c,Nate S,"Hey breedertards, it's me again. I noticed your logo stuck to the side of my phone screen and it's not going away, can you tell me why that is?",1,Kaspersky SafeKids
db926377-ad85-4794-b652-39aea94075d6,Ashley C,This app has been incredibly helpful to my family! Thank you!,5,Kaspersky SafeKids
a870cf15-3cc8-4987-9e8a-684f036b2108,Jojo Ali,"FINALLY. An app that is affordable, easy to use and install, and works without Google services. Thank you",5,Kaspersky SafeKids
fce06752-d039-4d39-bff2-4c184227094b,S MAHESWAR RAO,Excellent ðŸ‘,5,Kaspersky SafeKids
29b039a4-77b9-496a-ad8e-6fb76e67d397,Ethan C,Having the same problem as many others. The recent update has added a stupid overlay icon that sits on top of every other app and there's no way to get rid of it. Absolutely Infuriating,1,Kaspersky SafeKids
7e012c43-ca0f-4760-9e44-373749833dc6,V B,Good,4,Kaspersky SafeKids
5513bb58-fa45-43f7-ac40-f717421ca8c4,stone art,Very good,5,Kaspersky SafeKids
fa1dfc5e-0efe-469b-8be5-34983eee008f,Darkness Queen,"Even tho i unlock some apps or completly disable monitoring for my childs phone, it still stays locked. Stupid app",1,Kaspersky SafeKids
195227c8-ee9b-4763-b8b4-cfd46c9afeb3,marco antonio aguilera torres,"It doesn't not allow me to sign in, It says ""Cannot verify security certificate please check the internet connection""",4,Kaspersky SafeKids
52985fff-b2d2-4dc8-b44f-aec43a0ad02b,Johnny Outterbridge,"Doesn't work for most phones with IOs or wifi networks only :/ Wasted time and money, not the easiest to set up. Interface could be a lot simpler. Seems ok for android basic monitoring.",1,Kaspersky SafeKids
04b9f29f-2f7b-4358-a14d-8d9140fec1f4,Manish Pawar,Best free app to give you enough control over screen time for yor child,5,Kaspersky SafeKids
6f6acca8-e72f-4a6e-93f9-a5e4716e66d7,50PercentAwake,"This ""app"" if you can even call it that is a hella sketchy bro, I can't even delete it like what Is that?",1,Kaspersky SafeKids
00d74f27-6811-432d-8584-cdfb3bd0db3d,Desislava Taseva,"The app so far does good job. It's a bit annoying that I have to log into my Kaspersky from a desktop computer to set time limits for the different apps. It's great that as a Kaspersky user, it comes free it the pack.",4,Kaspersky SafeKids
333e5460-af89-476c-beef-603b39730f0a,Jr Zhen,Mostly satisfied,4,Kaspersky SafeKids
ba87612b-ea7f-4428-beef-6ae067066a01,Mohammad Fayaz,Kids requests doesn't appear in app. Have to use the Web browser version.,2,Kaspersky SafeKids
66cab6f7-2fef-40da-a128-b5a80b82bfb5,Ravi Nandola,Very good application for parents,5,Kaspersky SafeKids
c7275940-392d-4621-bf57-cd7bd000be6d,hanieh ahmadi,Don't get this app It's controlling my child's phone now and can't uninstall it,1,Kaspersky SafeKids
36571981-5521-432c-9c2c-0bb9c981f5ab,Joseph Miller,"Keeps bugging me to rate it. To be clear, I have already rated it, and it keeps bugging me over and over.",1,Kaspersky SafeKids
ca9c62ae-dac4-4eca-8bd8-8e65f1585d30,dean saffrett,Fantastic app. Really easy to setup with two different aged kids. I love how you can have time restrictions on but still allow certain apps outside of these times,5,Kaspersky SafeKids
63aaada0-f63f-4c2a-abb1-7260c671444e,WARREN KOPPENHAFER,works!,5,Kaspersky SafeKids
58693fc4-cff6-4969-9aed-7a02988cf5fc,Jason Jacks,Non removable overlay! Whatever happened that caused this stupid icon to be stuck displayed on top of every screen on my kids phone is unacceptable. Unfortunately I am forced to uninstall.,1,Kaspersky SafeKids
bf1c7816-813a-4843-a206-a9ba3f986152,Rodrigo Carvalho,"Permite seguranÃ§a e controle fÃ¡cil de permissÃµes e acessos no dispositivo (tablets, notebooks, smartphones, etc.) da crianÃ§a. Possibilita determinar o tempo de uso, aplicativos, jogos e sites adequados para a idade. AlÃ©m de permitir o bloqueio do dispositivo e localizÃ¡-lo em caso de perda ou furto. Recomendo!",4,Kaspersky SafeKids
4f233ea1-daa0-40ea-99ce-913e00c8c4f1,QUILLOU28 -,"It work fine , but when I want to delete it and I want to open the app from android it's just keep telling ""starting kaspersky..."" idk how to get rid of it :/",2,Kaspersky SafeKids
74d81e47-45f4-43b4-a616-e9917021b6f1,Muhammad Ali Khushik,Very systematic protection of Kids,5,Kaspersky SafeKids
e5fa5a93-9eb1-4295-8d52-66b347f24ae3,George Ashford,Rubbish. I can't control my daughter's iphone screen time via this app in Android which really wasn't clear when I bought the subscription. The website isn't clear on this. Customer service is very hard to engage with. My advice is to avoid.,1,Kaspersky SafeKids
e2b19c12-8730-422a-945b-43823c94417e,iLaND,not convenient and non-functional program,1,Kaspersky SafeKids
a2a77df5-1911-474e-b759-f45c6c5c5d3b,Nasreen Sajjad,Helps tremendously to control kids' screen use. Additionally the advice for parents is very useful. I also appreciate being able to monitor what content my child watches on YouTube,5,Kaspersky SafeKids
7f387ee0-5eff-4dc9-ab77-0d87443a1465,Natasha F,Excellent app.,5,Kaspersky SafeKids
2d5bec3f-51b6-4dd3-b663-987ccd332172,Isabel,It was acceptably mediocre until it stopped working. It no longer was letting me allow apps on my child's device. Anything flagged by it's filters was not allowed to be exempted. I was able to do it in the beginning but in less than a month that feature stopped working. I tried reinstall but it was no longer syncing to my child's device. Very frustrating. I'm switching so something else. The Microsoft family app was all i needed but that isn't compatible with the new device we purchased.,1,Kaspersky SafeKids
1e5609fe-6add-464a-a9d5-72b9cc6cd17b,Eric Nelson,"Has issues lately with allowing the OnePlus N100 text messages to work. Frequently craps out and doesn't allow any allowed apps to work when the phone locks, and my S21 Ultra shows almost no apps available to lock or unlock. Requires reinstall on both phones to get working again, but text messages never work on my child's phone when it locks.",3,Kaspersky SafeKids
9d0cb2f9-c45c-4ce2-b77f-58232bae2f84,Prince Gabani,Baps vala bov vapre aetle aa sav nakami app 6,1,Kaspersky SafeKids
a068d9c8-96bf-4721-b6c0-78e78fa82c41,Flymaster2022,"Horrible app, It's annoying because it doesn't really make it feel natural to use and it is too authoritative for me and I hate the entire kaspersky apps and I don't want it and it uses battery in the background (example:Fully charged phone, 2-3 hours later 25% and it doesn't let me install any app In my phone. And I am against the brand because it is Russian",1,Kaspersky SafeKids
77075a16-a4ce-41b8-9526-d31903646683,Marko Oreskovic,Very useful app!,5,Kaspersky SafeKids
213633e1-3722-47ed-a29f-0284a57d2bf4,Jay Gibson,"Ew just ew it ruined my life my friends ""dont have time"" once anymore since i cant show them things on my phone",1,Kaspersky SafeKids
90c6d5d8-fde7-417d-a589-d8978fa6475b,Dumitru Marius,"paying for this app was a big mistake. it has lots of bugs and i had a lot of problems with it: allocated time is wasted on my kid device when the device is not used (the device was on my office table and no one (not even i) touched. never the less - the allocated time was consumed); the kid requested more time but no notification was received - so i cannot allocate more time although i have try everything (restart, logoff, wait); the device is unlocked and the app lost configuration; and so on",1,Kaspersky SafeKids
d5c0e7f3-1518-4344-80ef-6f11b2596625,cyber bastion,work as expected. now I can easier to control the device,5,Kaspersky SafeKids
d16e083d-6710-4f65-a4db-243933e7b8e7,mohamed karam,Very useful ðŸ‘Œ,5,Kaspersky SafeKids
e7fe9e1b-18ce-46f5-ac17-3892c7e4327b,Mohammad Elayyan,Ø¬Ø¯Ø§ Ù…Ù…ÙŠØ²,5,Kaspersky SafeKids
c526b695-55ae-4523-b8bd-b21c8c56574b,Vanessa Botha-Tixier,"Hi, I bought Kaspersky kids through the play store. I did not receive an activation code. But I got an email from play store that I did purchase it. I need the activation key so I can access the full version",1,Kaspersky SafeKids
4b6b8a44-e7a9-498c-b0ef-3d786000f4a6,Recep GÃœZEL,"Even though I allowed all the apps for my son, it doesn't let him turn on Bluetooth. I set it only to track usage; I tried everything to allow and finally gave up. I am going to uninstall it tonight.",2,Kaspersky SafeKids
16b2c069-7176-4aeb-ab3a-250892c5d0b8,herman setiawan,Very usefull and helpfull to control gadget time,5,Kaspersky SafeKids
573d54b8-c64c-4a7b-9f7d-b29a4e5ffb12,Rizky Ananda,"Kaspersky safe kids is the best second option for protecting our child just like i'm using google family link to protect my child from adult content. Is verry strong and great parental control forever and ever. Keep continues kaspersky team. Hopefully on kaspersky safe kids, you guys added the features like the menu or option for youtube like blocking some content that our child not good to see. so our child can safe to watching and we can choice which content category that we should blocked",5,Kaspersky SafeKids
27a0ef36-d019-4e87-8508-6797225305e4,Santiago Cisneros,I hate this thing ðŸ˜®â€ðŸ’¨,1,Kaspersky SafeKids
b3cdbf25-a7ad-4007-a872-073104a5d317,UBS Man,I hate this my dad sets 2 hours and it just ends in 8 minutes,1,Kaspersky SafeKids
b429e126-cc1f-4c55-aefa-9661db5c1e14,Gareth Durand,Excellent app! Would recommend for anyone wanting to monitor and teach their kids about being safe on the internet. The advice on how to engage with and teach your kids about being safe in the internet is excellent.,5,Kaspersky SafeKids
2917d21f-e3de-413a-aa38-5cb392037a2d,Milan MilovanoviÄ‡,Couple of features missing... But great app with cheap subscription.,4,Kaspersky SafeKids
b821492e-e589-4f01-9a90-27212115616e,K G,I have as much control as I want,5,Kaspersky SafeKids
5b46db2c-4f86-41da-a5c2-78870bc57a77,Mikhail C,"I don't use Kasperski SafeKids on Android anymore. The main reason - it works no stable. One time each several months something goes wrong and list of exception apps is erased. Sometimes reinstall app on target device helps but the last time it didn't work. Finally I migrated to Google Family Link. It works quite better and has some useful features (for example, single increase of usage time without changing schedule). For Windows PC I'm still using Kasperski SafeKids and it works fine",4,Kaspersky SafeKids
21342da4-1d58-4598-b71d-52c2bb1a3408,DUY ANH HO DIEN,This app suck,1,Kaspersky SafeKids
e201b6f2-8682-47ab-9717-0aed7bc51b0c,Alden Seow,"Parents, please ignore all the review bombing and fake negative reviews by disgruntled children.",5,Kaspersky SafeKids
1418f26c-dba2-4076-b528-9b5f46e357cd,Bakula Koyani,This is a nice app,5,Kaspersky SafeKids
fe07f4ab-7d3f-43bb-9fae-3ec404986a1e,Schola kerubo,So far so good,5,Kaspersky SafeKids
bdede797-b5df-4067-b1ed-9eb3fce82759,Engineering Consultant Maher,"It is really useful to monitor your kids especially when they use the mobile, and what are spending time",5,Kaspersky SafeKids
e5848d06-3dfa-44c1-89b5-6bb3aa2a3667,Kirill Kazymyrenko,Good and easy to use. Free version IS sufficient to start with.,5,Kaspersky SafeKids
169f1ae4-7c38-45da-9b69-102170974b0f,Mohamed Abdulla,nice app,5,Kaspersky SafeKids
c4c1839d-3f90-444c-b950-9835301ddf5e,Lauren Anderson,I like this app because it does what it's supposed to. I don't want my child turning into a screen zombie.,5,Kaspersky SafeKids
fd7bebaa-baff-47b9-8ef4-b2dc2d2981bb,Adel Ammari,"Barely Works. Kids send requests which i never get. And if i get it, it would be months later. It's pretty useless as it stands. Kaspersky needs to fix this, or stop offering it altogether.",1,Kaspersky SafeKids
b0531a3f-370f-4d72-bf3a-f17561d4c1c7,Hendra van Niekerk,"Loved it, now frustrating. My wifi company reset our router and now I need to re-enter the wifi password but Kaspersky Kids keeps blocking me and I can't insert my password as I have 0 wifi connection. My kid's expensive school tablet has now 0 access to the much needed internet, thanks to this app. There is no way we can deactivated this app just to setup the wifi. It even blocks safe mode. I tried EVERYTHING. I hope chat comes back soon as I am highly highly disappointed in this app.",3,Kaspersky SafeKids
54ef8d31-b98b-4a9d-af82-9923471e76c7,Steven Doran,"I installed this on my kids phone after I got him the phone for Christmas this year. He wanted to use YouTube which was a allowed app but it still wouldn't let him open the app I called customer service which was zero help put me on hold to ""check his resources"" for 10 minutes then when he came back he told me to hang up and email him the problem.. a day later get a email saying to screenshot the problem... I already told them the problemthis was a terrible app to download.Uninstalled canceled",1,Kaspersky SafeKids
f1faf5fd-ee53-452d-8bf0-e02c4ffac451,Arthur Agababian,"I got the Full edition, however can't install the parent module on my phone (S21). Tried the installation for a few times, but it always hangs stopping on the ""setting up..."" screen. Tried to reinstall it few times and to restart the phone without any success... not the best experience",2,Kaspersky SafeKids
25464dae-523f-4608-9078-594ba4e3de8e,Goutom Chandra,Nice apps,5,Kaspersky SafeKids
611658c4-68d4-4ec5-a30e-02f11456c214,Stan Bernuhov,"The app is a pain. It continues to block apps after I gave my consent, and it fails to block those which I need to block. I'd say, it works with 50% accuracy, which is not good when you are managing many kids. The most annoying is an automatic ""support"" robot, which doesnt help at all",2,Kaspersky SafeKids
4604b130-480c-4962-94c1-d780af4956b3,Mohammad Nigm,"The app is great and is giving me a great parental control, but there are some few features if added will enhance parents experience such as the ability to add bonus time to the child from parent app and the ability to immediately lock the child device from parent app",5,Kaspersky SafeKids
7ac186a9-43c3-4ef4-8ea1-27733ea7c675,Carmen Chong,"Well function, now I can monitor my kidsâ€™ tab/phone time. Recommended to all parents.",5,Kaspersky SafeKids
