reviewId,userName,content,score,app
c7063cad-cc11-47dd-876b-33d1f538dfbd,Yan Vulich,"According to most reviewers online, it is one of the best apps on the market, but except browser blocking all other functionalities are not working or working partially, really hope it is temporary problems and will be fixed in the future, for now: looking for alternatives.",1,Net Nanny
f77ed92b-4bb0-4b91-b5d8-a5aa02d28267,Robert McKeon,Blocks too many sites that aren't harmful.,2,Net Nanny
cddeb392-475a-4f91-b488-390bde180b8a,David Hanna,It does not work. The kids spent all morning downloading whatever they wanted in spite of the internet being turned off. I've been text chatting with their tech support all morning without success. It just doesn't work and I'm done trying,1,Net Nanny
307558fc-b365-4783-b181-53c8d8856062,Gord Holland,Great app to help control settings and monitoring screen time and kids say it helps block all the junk they/we don't want to see.,5,Net Nanny
0aeeae13-7dfd-4b27-b008-d5e08363aca9,Leandro Gado,Doesn't work. Waste of money.,1,Net Nanny
c60b1e44-95b9-4719-97a1-0aae9fc58e2e,Adele Tan,It doesn't track what is viewed on YouTube even though it claims it can. Tried updating the app and it still doesn't work. Would be grateful if anyone can share how to fix this.,1,Net Nanny
e0b468c9-9efc-4aec-9122-2a854640db2c,Zainah Khaliq,It has so many glitches and gives more work than before. For example on the laptop you have to shut down the laptop every time. We usually just put it to sleep so it is easier to open but that counts as screen time. On the phone if your phone is off but something is still connected to the internet it still counts as time.,1,Net Nanny
1a13d8bb-1d71-4022-9827-9dfb4bc55de3,Brent Stephens,"Doesn't work. The only part that works on android is the ability to limit search terms when a browser like chrome is used. Otherwise it is useless. Even after the time limit is up, youtube still works. Its basically almost worthless. Youtube is almost in monitor able unless I am there in person constantly.",1,Net Nanny
9eb95598-0cd1-4284-95a5-7e49e38fb368,Robert â€œBobâ€ Braunstein,"My son was able to put the app to sleep in his words. Unable to get the app to filter unwanted sites. Uninstalled the app. Tried to reinstall with a new subscription, icon is on his phone, app still not working. Now what?????",2,Net Nanny
a923b04e-1db0-4a0a-829b-e628a7bfcb12,Y Huesca,Unreliable,2,Net Nanny
a55499e0-e816-4bf8-a8a1-2dccd5311b9f,Julia Seipel,I bought net nanny in the hope it would help me curb my son's addiction to YouTube since his grades were suffering. If it had worked it would have been ideal but unfortunately it simply did not work!,1,Net Nanny
6f1a6da7-5cdf-4b8f-935f-1cf198e3e6d6,Brittany Anderson Pridemore,The location hasn't updated since 9/4/2020.,2,Net Nanny
dfe01cc4-41ec-4a24-8b28-580603a08285,It's x-ray,Coool it does it Work,5,Net Nanny
80cf563d-4a85-403a-b028-5c60c95800d8,Jennifer,"I really wanted to like this app. In the beginning it worked well. Over the last month or so the app crashes and then it does not protect the devices. It is a constant game of uninstall and reinstall. I bought the plan that would be able to protect ALL our devices. Unfortunately, I have only been able to install it on one device because it keeps causing so many problems, the app crashing to not allowing the device to work properly. Currently in search of a new parental control app.",1,Net Nanny
5845c79d-939e-45e5-b405-840d6949a2e6,Urooj Amin,"Useless app. My kid used her tab for 3 hours, while she's connected to wifi, & app shows only 12mins used. It doesn't follow schedule. What a waste of 60USD",1,Net Nanny
aef1d1b5-6d54-4c52-99a8-ce760fd8b030,Kenanao Motlhoiwa,This is the worst App I've ever come across. I bought it as a recommendation from the Head of ICT learning at my kids school. I made the mistake of not reading the reviews first. I purchased the 5-device package and installed it on 1 Mercer notebook and an iPad. IPad: kid online 6 hours and it reports 0 hours screen time. Notebook: blocked internet though it's reporting more than 2 hours of screen time left. Increasing screen time not helping. Now it won't let me uninstall it. How crazy is this?,1,Net Nanny
6e29529f-a31f-4c37-80c9-663fbeeb3aa5,Shari Wagner,This app stopped functioning multiple times after payment was made. I wish they would refund my money.,1,Net Nanny
a4812c4d-93c5-4b48-b21b-b96cf35a2d5d,Gwyn Richards,"Not very user friendly at all. Google Family Link is more reliable, and free. I definitely wasted my money on this app, we only used it for a month and I paid for a year ðŸ¤¦â€â™€ï¸",1,Net Nanny
50bf7666-bbb8-451b-ba20-a1bcfca7c333,Franziska Marks,"Not recommended. Buggy, not reliable, delayed in reporting screen time used. Unable to block specific sites",1,Net Nanny
880c2888-de6b-43d5-9b6f-841e8118f843,David Etzioni,"Absolutely useless, doesn't work. Will demand my money back. Horrible.",1,Net Nanny
075f5dad-de5b-4bc6-a0c6-ddad6fc88ef7,Jarom Smartt,"Technical issues seem constant. Technical support fixed a few but not all. Parent and child apps routinely crash. One one child device, it crashes everytime a child device is out of minutes and so there is no limit imposed. Parent app will not always give me visibility on how many minutes used, apps downloaded, etc. Android devices. Disappointed.",1,Net Nanny
2ffea090-26d6-4342-9eca-e2b87d8bf4b9,Angel Lopez De Victoria,Don't do it. Its No Bueno,1,Net Nanny
aa0fdfee-a79f-4fe4-be05-4fe0f9f3e36d,Rij Eappen,"The app just doesn't work! Set it up and added a laptop and a mobile, and it doesn't block anything, no websites on the laptop, no apps on the phone, absolutely rubbish experience. Spent hours trying to figure why it doesn't block anything after all the devices are synced. No clue. After activating the disable internet feature, nothing happens. I just want a refund!",1,Net Nanny
b6ca9ad0-d820-419b-926a-7e5d77afe3f3,Kaisma Penn-Titley,"Works for what we need! I am able to disable device and internet useage when necessary. I have yet to manage a mobile device with it. After spending sometime around the settings and asking support questions, I am more am pleased with the product, thus far. Sometimes it may show a blank screen when switching users, or between a feature, then eventually what you click on appears.",4,Net Nanny
11f93b35-aa9a-4412-899b-d5f72c3405a3,carlos aviles,"Purchased this app to help control the content my kids come in contact. I have had it for about a month. The app kept closing, app error, and it slowed the phone down. My kids were able to do what they want while the app was on their phone. If I had a block on an app they could still access it. I removed the app and reinstalled it but it still did not function properly. I hope I can get a refund.",1,Net Nanny
02a9dee5-08a9-4f95-8ae0-ff66141315d8,Amanda Christian,Since your update YouTube is no longer being blocked on my child's device although it's showing blocked on my end. Please fix or refund money.,2,Net Nanny
ad6920b8-c405-4c5c-9f45-1e82e6be4ff2,Trevor Cardno,Difficult to use and doesn't do what I need it to.,1,Net Nanny
c21cf8c8-a09d-42bb-8ac7-7c6c9c5d525c,Tazabiw Sew,Not is easy to cancel subscription,1,Net Nanny
f026fcca-9d74-4ca4-ae8e-87a4658a83d3,Juan Salvador Morales,"Not satisfied. It delivers short of what is expected. I bought this yearly suscriptions for a year. I should have tried it first. I bought it for the kids' Samsung tablet and Ipad. The set up is definetly not ""plug and play"", you have tinker with two different apps, one for parents and one for kids. It can be easily removed by the kids, thus it stops monitoring the activity.",2,Net Nanny
0f38cfda-bee2-485f-91f2-b3c28532070b,Chris Townsend,The app caused my child's device to constantly drop calls over google duo. It took >14 days to troubleshoot and determine the cause of the problem was Net Nanny. I was denied refund b/c it was >14 days. I still have Net Nanny paid for until 6/2021. That is 11 months and 13 days of uselessness that costs $135. . Definitely don't commit for 1 year.,1,Net Nanny
e774d5b1-883e-419a-9867-6f464d84bc40,Donnacha Doody,"NN worked inconsistently, and was not what I would expect after paying nearly Â£50 for it. In particular the pausing and unpausing my son's phone seemed to work intermittently!!. It frustrated me and him so much that despite having paid the annual subscription I deleted it and switched to Google family link instead. It does basically the same thing as NN, has worked consistently and is free.",1,Net Nanny
a13a2bd0-0b74-48d6-99bc-b6c0f14ab67b,Joa-Marie Diedericks,"Will not recommend this, as soon as you a paid client the app stops working and support from the app is poor. Wait days for answers and yet the app still not working.",1,Net Nanny
6846f00a-fbe8-4563-a922-2f93f30d2c48,Belinda Hanson,"I rarely write reviews but this is a shocker. It just doesn't work. It constantly says ""last online *3hrs ago"" but my son is sitting next to me using it. He goes to the bathroom, I test it, search ""porn"" BANG! Pornhub videos. I want my money back.",1,Net Nanny
818f8c68-9475-467d-b79c-028d9c9bd445,Ankit Kapur,Bakwas,1,Net Nanny
b489a36b-77be-481e-ae42-825c01fde65b,Louise Cloete,Please let me know how ho cancell the annual subscription and reverse my payment.,1,Net Nanny
911be47e-d0ab-419d-b9ad-4bdf688b4401,Doss Solomon,"Does not work as suggested, it resets settings if the phone loses power. It's unreliable as it did not block adult material. Very disappointed and money wasted they should give me a refund.ðŸ˜©",1,Net Nanny
4b757b43-d452-4a3b-90b0-30045e46b7ea,B Fernandes,"Will not allow Blackboard collaborate - kids online school platform for class. Does not tell us it is blocking just blocks, took hours to figure out the problem. Only solution was removing Net Nanny.",1,Net Nanny
8bbc3859-df0c-4d34-9775-c5742babc21b,Nadia Nweke,Unfortunately I have not seen the benefit....anytime I get an alert I am not able to open the app even after I updated I have subscribed for over a year patiently hoping things will improve....please help,1,Net Nanny
885b8fd6-018c-4753-9671-84b1e51fcfb4,Eni Scotchy,Amazing!,5,Net Nanny
7f468702-195f-4490-b515-e481a4cbc0e5,Pierre Joubert,Excellent!!!,5,Net Nanny
ba3c4abd-43ae-463d-97a3-fc97f49db878,Shahar Burshtain,Super ez to hack i'm a kid and all you need to do is to force stop the app,5,Net Nanny
b9206edf-b75c-45f3-b065-bec13cca673c,Brit inCali,"It's so unreliable. It's endlessly telling the kids their time is up even though it states they've used just a few mins. So you end up turning off the rules, which defeats the object of it. The GPS positioning never works. The app generates false warnings and blocks things that are fine. Just utter garbage.",1,Net Nanny
cad6a62f-8080-41c4-bfde-70252eaee523,Joe Audet,So far so good,4,Net Nanny
4165c0d7-1712-4ec1-afab-ea176c8d0006,Kholt,This app is garbage! Never worked correctly on either of my kids phone! Waste of my money.,1,Net Nanny
d647de78-8815-46d0-86d0-109eabe794b6,Ryan Victor,"It blocks basically all websites and blocks many websites for everyone. It blocks all swimwear including swim trunks and it even mistakenly blocks some t shirts or shorts. Whatever you do, do not pay for this app. I would give it negative 5 stars but sadly, there is not an option for that.",1,Net Nanny
40078cfa-356f-470f-a32f-42b494feb8c7,Lea Insley,This app does not do what it claims to do. Tech support were unable to fix issues. Impossible to uninstall from any device. Subscription expired and I refuse to pay another annual subscription just to uninstall the app. Buyer beware!,1,Net Nanny
093120fe-8ae7-48ac-9e44-fdf95ca23967,A Google user,"Wanted to like it, struggling to see locations. App keeps shutting down Everytime I try and open it. Have to uninstall and reinstall. Very frustrating",2,Net Nanny
600c1bc1-5a62-4bfb-b4da-c0f5197596c5,A Google user,"Do not use this app if you have Google phones . After updating to NN 10 both of my kids pixel 3 phones are unusable. You can see search results but cannot open any web page. I have reached out to NN 3 times over three months with no resolution. There was no attempt to fix my issue and no follow up. I also was told that there is no refund as I was over the 14 day refund policy. I have never left a negative review for anything, but as this was such a negative experience I had no choice.",1,Net Nanny
d2cf2b4f-61d9-4e34-aa72-5e71359c531a,A Google user,I hate your app,1,Net Nanny
77ada956-dbe8-45b5-b4bc-ce2c73af61e5,A Google user,"I just had an update 2 days ago now the only thing working is location tracking and when I see when they are on their phone, but those only work sometimes. He has been on youtube and that's not showing anything. His app usage I cannot see. It does not update. It was working before and now the money I paid for it isnt worth it. Please fix this! Update: 4/11 eventually it started working. Now with a recent update on their phone I cant see anything. App usage and last used doesn't show anything.",2,Net Nanny
7b18117f-b17d-4c2d-81a0-4e6be02c5deb,A Google user,Very effective,5,Net Nanny
f5f85f38-e9bc-484c-8c0b-f7d0aee8e275,A Google user,"Very helpful app,",5,Net Nanny
ad116d3b-930d-4dd5-a591-48ee7d9be1ab,A Google user,Love the setup,5,Net Nanny
51ef9cb8-8c43-4f5c-82fd-12c2a8b84e5d,A Google user,Dont waste your money. Netnanny sucks,1,Net Nanny
f51815cb-3c6b-4c15-b018-a3cc28aae563,A Google user,Good but I haven't had it long to make a good report.,3,Net Nanny
92997c20-2471-4866-9b10-04d5d3689b44,A Google user,Very granular permissions.,5,Net Nanny
900ea9cc-74ab-4899-b2c5-3367d12da5b6,A Google user,I like the ease of changing schedules and blocking content. My one complaint is my daughter is still able to download apps like instagram to her computer even with it specifically blocked.,4,Net Nanny
716be7a6-de4d-4ec5-87a2-a5776d72d188,A Google user,Great to monitor kids addictive nature. I hope they get up and running for Chromebooks next.,4,Net Nanny
d57aaeda-239a-4d85-aeab-886ad7e3807c,A Google user,I wanted to like this app. What it was supposed to offer looked great. But the interface is terrible. I'm constantly back and forth between screens. There's no main dashboard where I can see all my kids at once. My son told me he couldn't access anything and it took me forever to find out what the reason was. I might have given it more time to understand but I'm not jumping into a 1 year plan when I had 3 days to test. Norton gave 30 days. Might have to keep looking...,2,Net Nanny
9dfd548f-5e0c-4096-b0f8-6e4d41ab1949,A Google user,"The app has great ideas and if they worked as planned would have been a great app. But it keeps failing. I have no reason why. When I called customer service to complain, I was told I can ask for a refund directly from Google play store. No offer to help fix the problem. I am still baffled from the experience with the customer service agent.",2,Net Nanny
61289c28-b11f-4c81-bd4b-c81f90fd1ec1,A Google user,"Useless!!! Dont spend the money! I paid the premium price and never recieved the services promised. After spending FAR too much time trying to get the app to work on mine and my daughter's phone, the next day she was able to delete the app rendering it USELESS!!! What is the point to this app to limit your child's phone addiction if theres no way to keep them from deleting it?!?!? -it was a pricey service that was quite misleading .",1,Net Nanny
8e088166-462f-4612-a88a-339e79a5bb7c,A Google user,Terrible doesnt work,1,Net Nanny
3f5a32c5-5378-4ef4-9888-cd3a3c154661,A Google user,An app that costs money should have less bugs and issues. It blocks functionality sporadically. My daughter can't even call me when she needs to. Very disappointing. Do not buy this app.,1,Net Nanny
a7031792-a818-470c-ba2b-8c6cdcfad481,A Google user,Sucks,1,Net Nanny
73e16b45-4665-471f-94bc-60f06929c98e,A Google user,"I wanted to log in, but the app says i have the wrong password, i tried to recover but no email was received. Yes, i have the right email. What's going on?",2,Net Nanny
7608bb11-50d2-4e13-b679-1f6a44e203c4,A Google user,It blocks the internet...but it didnt unblock it til i uninstalled everything? I head google has one i will try that,2,Net Nanny
7db8379e-85fc-436f-b815-fce64555f41c,A Google user,Garbage. Doesn't work or update unless the person you're monitoring launches their app. Support said it's a known issue and immediately issued a refund!,1,Net Nanny
cf646a42-41ef-4a49-80cc-e6d7fa0eced7,A Google user,Doesn't work well from iPhone to Samsung. Always stopping my child's phone.,1,Net Nanny
6b577024-7c34-45e5-91d5-f3df80e809ea,A Google user,"I've had this app for almost a year. It takes up a lot of space on kid's phone, doesn't send updates or alerts.",1,Net Nanny
c707e307-bdb6-458c-abe5-3f394ff51720,A Google user,"Worst app for parenting, for my child it said that he used 2 hours when he barely uses his phone. Trust me . U don't want to use this app",1,Net Nanny
8882ee42-3ef2-4e0e-b3df-a223e7b845f4,A Google user,Laggy and really crappy,2,Net Nanny
8f86b03e-c41b-4770-902b-77db0fd98c08,A Google user,I have been delighted with this product so far. Is there a trick to getting the new YouTube logging feature to work? I'm looking forward to using that.,5,Net Nanny
b2a7b1da-8555-49fa-989a-48bf8c987d98,A Google user,This app is a joke. Does not work. My child was still able to download apps and go to sites and the screen time doesn't work. If i could give zero stars I would. It also extreamly hard to get a refund.,1,Net Nanny
67583f74-4496-4df8-942a-959a0a8fff5c,A Google user,Poor customer support. I have had issues from day one of install. Tried to start a chat but either they're unavailable or the support person logs out after joining. Emailed several times with no response. Really want a refund but nobody is available to talk to about that.,1,Net Nanny
f32dfece-078a-40fd-a02e-d44f9a2db6f8,A Google user,Blocks all internet on my daughters phone all the time. I will be requesting a refund,1,Net Nanny
8c4e7d80-3971-4d38-99a2-c9f224f3207c,A Google user,Would be a good app for young kids but not tech savy kids. Finally got app working and screen time schedule to disable the internet but within 20mins our 15yro worked out he could disable the VPN and had full net access again. Disappointed that it was so easy to disable. Discovered Iphone already has a screen time lockout function which works much better and it's free. Was issued a refund.,1,Net Nanny
8129dd39-64bc-4ff2-b0da-a7c902592f7b,A Google user,Couldn't setup on my daughters iPad,1,Net Nanny
ffa85bea-4b6f-454a-bbf5-c3c4e753152d,A Google user,"This app, in combination with the children's app was barely functional. It is incredibly easy to get around and the app crashes too often to be effective. The children's app hasn't even booted on my child's phone for months and the administration protections (eg password lock and wifi logins) stopped working entirely. In addition, the customer service did not address or help the issues. After promises to help me out, I have not heard anything. I recommend against this app.",1,Net Nanny
43361037-efaa-4bbf-9e03-da6fe7036095,A Google user,"I purchased the subscription and have been using the app to manage one of my kids devices and it's not working right. The limits I place do not take effect and it will lock the internet and pause the device during usage time. Not sure what else to do about this or how to fix the problem. I've tried rebooting, uninstalling and reinstalling.. Any help would be useful.",3,Net Nanny
c73aa403-3930-4de5-92c6-c32319bb5229,Keana Fitzgerald,This app is amazing. My 13 year old was up so dangerous activity an lucky with this app I am able to keep my kids safe! Also when u put your child on punishment u can lock everything with the app,5,Kaspersky SafeKids
a5178e42-b614-4b7e-a4b4-42a1260c43e3,Kirti Gopal das,Hare Krishna good app,5,Kaspersky SafeKids
316ded22-c4f4-4e97-b0ed-e63b00d1590a,Babaki Pari,Safe all things to u personal work mom,5,Kaspersky SafeKids
349b87c8-c356-4b5f-af3c-7caa901b715a,DarÃ­o Pinto,Pretty good for windows and android and very good reports if you get the very reasonable paid version. Cons. It is not available for Chromebook:-(,4,Kaspersky SafeKids
3479118b-34dc-46fe-96df-c02e197c1107,Snowwolfboi,Wish there were a feature to detect inappropriate pictures on childrens picture gallery,4,Kaspersky SafeKids
6fecf133-c87f-4ec2-9199-28aeb057cb15,James P.,Really easy for kids to disable.,1,Kaspersky SafeKids
4085c1e3-4dbb-47ca-af5b-61e6979eb382,NaingYe Thu,Block/unblock often stuck and not working as expected. I bought 1 year but even want refund after a few times of frustrating stuck My kid use ipad,1,Kaspersky SafeKids
3220089a-6c7b-4aa3-b5c7-9b468512f67e,r m,Works for me,5,Kaspersky SafeKids
0e046cd0-3f56-4021-882d-346f8931fca8,Mou Den,Good app,5,Kaspersky SafeKids
e8993aac-fc7f-412a-a6bd-1b5f20447464,Dr. WN Sisto,"This does not work consistently. Currently it says my child's device is blocked, but his phone is not blocked. Contacting a human being for customer support is impossible. This was a waste of money. If you have an android, use the free android parental controls.",1,Kaspersky SafeKids
517cfc5f-b11e-4187-82fa-fb0942ee826a,Tamunoibi Walter,Very good.,5,Kaspersky SafeKids
b34f2bad-e23d-4a35-81d2-64c0cd8d9ebc,Michal Szczech,"Intuitive, does what it it is designed to do pretty well",5,Kaspersky SafeKids
dfbe7adc-ae28-43dc-86c9-17fce721472a,M Houshmand,Best application for monitor child's.,5,Kaspersky SafeKids
185950ab-a999-49a6-9a01-7407499e6448,Kuba KÄ™pski,The app sucks,1,Kaspersky SafeKids
da41665f-8bd2-4268-a595-9dcecadaa710,Ashok Rana,My subscription is not activated,1,Kaspersky SafeKids
416d6db3-a6f7-45ca-aa22-c25199d6dd3a,Yuno Otsuka,This app is great ðŸ‘ðŸ‘,1,Kaspersky SafeKids
9c80eeb9-32a5-4aa8-b8fc-4ec8e00f2bc9,Rahn Vert,The App Is Great (on paper). It refuses to load quit often on every Samsung device I own.,1,Kaspersky SafeKids
67b86b2e-6480-4e98-b555-d60b95b767fe,Sam Fish,"Impossible to uninstall from my kids device. I need to upgrade my kids device and in order to do that I wanted to wife the device clean, I was unable do so (yes I'm the parent, and I logged in through the parent user name and password, I even tried to take aways some of the permissions, didn't help)",1,Kaspersky SafeKids
86217bcf-b552-44ea-b6df-32425f34e915,Ba1atu,"Hard to configure, not for the average user! Screen time doesnt work. Child can access certain apps even after the time limit.",1,Kaspersky SafeKids
d7830fb5-7385-4e9c-b180-a7437891045c,Steve Dabin,"So difficult to set up Android to iOS. Can't set or change time limits, doesn't accept requests for extra time, basically completely unusable and a waste of money.",1,Kaspersky SafeKids
47f64ccc-62ae-459e-ab31-a03c649213b2,Richard DOUTI-LARE,"The application is easy to use. There are some missing features (ie rename monitored areas instead of the gps location, chat between parents and kids).great app",4,Kaspersky SafeKids
ba77af63-d727-4279-9f92-2ec0469d1e1e,Mehdi Gargari,"After the update, It is not working anymore! Not reflecting the changes on the account! Mobile: Galaxy S22 Ultra",2,Kaspersky SafeKids
6b38f21e-40e0-4584-974e-f1e3c358b57f,Anton Ignatov,It's not an application for the phone as far as the full features are available only on a portal with full browser access. Notifications are useless because they do not tell which link or app the kids open. There is not a simple button - block the laptop. It's a useless info notificator rather then parent management tool. Sorry.,1,Kaspersky SafeKids
829a1712-7e06-4f0a-a51f-f168b6411bae,Xisr Rein,Developer options are not blocked even though the app is using Knox. Fix that please and maybe consider making it more battery efficient by removing the pop ups for security even when Samsung Knox blocks it anyways.,1,Kaspersky SafeKids
7446c79a-d4cc-499b-bb1c-285338ac51a5,Willem Barnard,would be great if the app had a block button to immediately stop any activity,4,Kaspersky SafeKids
7a4a3528-7ae7-4a89-a099-d324b114e0da,Rickner Montilla,Great App!,5,Kaspersky SafeKids
d18610cd-7f26-4c38-860a-78b4676710f6,Ahmet Soyen,"I have Android, my kids' iPhone, so couldnt succeeded to control over application. How can i solve it ? If not, how I can take my money back ? Thanks...",1,Kaspersky SafeKids
727aaa5e-a732-4026-b136-6314a25474b1,Anish Mathew,"Helps to control kid's device usage; but sync of settings to kids computers sometimes do not work; also, addition of time based control of internet restrictions would have been nice;",4,Kaspersky SafeKids
4c015d7d-093f-4e84-82a2-5fce2dbc1022,Steve Tutt,Great for parents of teenagers,5,Kaspersky SafeKids
