reviewId,userName,content,score
9b96fe32-d8bc-448f-bf37-eaa79506a6b6,Tugsan Topcuoglu,Waste of time,1
d5cb1046-ee6d-4fc5-ac03-c873e6ded9df,Roxanne LaRusso,"I am extremely impressed with Mobicip's Customer Service. They are very quick to respond. Very polite. Very professional. Very thorough. They stand behind their product for certain! How refreshing, these days, when it seems like no one takes pride in customer service and employers don't really care who they hire. Not Mobicip. They definitely stand apart from all others.",5
fe265e2e-117d-42b2-b8ca-63fc24e551b3,Williamcadder Mutevedzi,Friendly,5
f44146dc-a7a3-445e-8183-6b153f482555,Justyna D,Does not work,1
69bc7a7b-1cca-409f-96b1-8b19288ab427,Liam Whitwam,Invades privacy,1
e3b10183-438a-4836-9219-b1f3bb1f7d12,Auwal Ahmed,Its really working,5
7c170de3-d46e-4514-a947-4f466ebaa333,Marios Lemoniatis,Excellent app. Great support,5
1588fc82-c959-45f4-8dd1-35e3ed70374a,coby jay,Mobicip didn't even block the apps I selected to be blocked (Settings app and Accessibility app).,1
44ddfdeb-11d3-41d1-aa98-9ead1e5d6466,Bennit Derby,My son got through it some how,1
b203826a-bc78-4697-8e87-76c888ccb53c,Marcus Johnson,"Had this for my 4 kids, worked well and helped me help keep themselves safe from the junk that's out there. Recommend this for sure!",5
4d93759e-2dac-4fe0-be62-c10c027fefcc,bobbie jean baker,"It is horrible!!! I would not recommend this to anybody,! They control all of the functions in your devices when you install the app and make an account a third party is in control of all the devices that you are using that app on so if you have three kids and you're trying to control the things that they see and you get this app thinking it'll help you. It doesn't! it even blocks the parent out half the time you can't use any of the devices that have the app Installed.",1
0ff7790c-4d4f-4cd0-bfea-faa90867316f,Arlin Hurst,Best content filtering option. This filter allows me to use all the features of my phone and works as a VPN which is a good thing these days! Tech support was quick and efficient for the minor issue I had.,5
37034fdb-ecf4-48cb-a0c5-35c9c03d2f49,Jeff P,Mobicip is the best parental control app I have used. I tried multiple parental control apps including all the big names before trying Mobicip. Mobicip was by far the best. It was the easiest to install. It provides a very easy dashboard that has lots of good information and usage to it. And their support is amazing. I submit a question and a real person provides real helpful responses in less than 24 hours. What more could you ask for.,5
9eee0f28-0ef4-4a4f-a1e3-f9c66d6cc11b,roses cokkie,Terrible,1
b6acb2a9-1682-4d9e-85dd-3cd57f198fb2,Lenso TSG,How do I remove restriction from particular child?,1
57f081cc-5de4-41fd-ab72-fc5b10f725bf,Michael Chukwuemeka Thompson,"Kids, just go into your device's ""safe mode"" where mobicip cannot operate. Go into settings and go into app permissions and turn off ALL permissions for mobicip and the screentime limit will no longer work.",1
18d60704-aee0-4c3d-a5df-09d86829aac0,Cameron King,"While I had challenges, the professionalism and understanding shown by your support team have been commendable. I will keep this in mind for future considerations and will not hesitate to recommend Mobicip based on the quality of their customer service.",4
620b3164-bebc-4f86-907d-18248cabffc2,Leila Schaefer,Sucks,1
aa855d69-bd31-43fc-ae44-757efb6ba8f4,Mboloh Randolf Yuh,Sweet,5
5ef091e1-8d39-49ee-9be7-ad86f7f9cf05,Matthew Dean,Not official I don't recommend it because when you click child it has you add somebody else as a child so it doesn't let you do what you need to do so I don't recommend it please uninstall this if you have it it's horrible and do not buy anything from this developer,1
08e6c1ff-cf18-491d-879a-3d426de8756e,Matteo Albanese,Horrible,1
c493aae8-2661-40e8-b4de-73c46678e1dc,Jason T (JT),This app did not work well they are asking a tremendous amount of money annually for an app that doesn't even work properly It caused arguments with kids & parents. Save yourself the hassle just go to a different app.,1
85e0755b-38a0-464c-94cd-8e52c13fa8b0,Marilyn Bouman,Did not work,1
0c9d5fee-3a4c-4f16-a197-2ea476ba9177,Archana Saxena,New to this app,5
f7ae1a63-c95b-4a57-b734-bec6affb89bc,Nate Binzen,"Works good until it takes over my kids' iPad and won't let it out of the Mobicip app to access anything else, or restart, until, literally, the battery runs out. Try explaining that to your kid.",2
b4420dc1-c194-41ba-bf2e-c488e0018149,FringotOfficial,Horrible it never works,1
da839a02-8775-4ec4-a796-c4ff6bc33885,Chiran Alexa,How to make sure you get the worst room at the retirement home and never see your kids again after they turn 18:,1
08e52aa8-6643-4ff7-a750-4b6fab62ba5b,Kaydence Butler,Disconnects,1
d5847722-5aa0-4cd3-8058-ab10cf2e32bf,Annise Arntsen,"Dear parents, stop micromanaging your kids' lives.",1
285287dd-23e8-442a-b142-e8178c5f9af0,Joylen Diaz,We used this app for parental controls and it stopped our internet and kept glitching.,1
39125ccc-061a-4114-a09d-c5fb5f4e95cc,Chasity Ross,IDK! NVR USED IT!,1
b9d7dc3b-9e94-4a51-bf5e-f754532dfbdc,Bradley Newswanger,Blocks the sites that are specifically allowed.,1
bcfea9e2-6050-4e33-b8d5-38400bfe4dbc,Suetta Miller,"I have used Mobicip for my family's laptop computer, Chromebook, and smart phones for many years. I can't give it 5 stars for the phones, because my kids figured out how to get around it too many times. However, for the Chromebook and laptop, I would definitely give it 5 stars. It does sometimes have glitches or slow things down, but whenever I have contacted Mobicip Support over the years, they have been prompt, patient, and have helped me figure out what went wrong and told me how to fix it.",5
0c017de7-58a5-4f69-90f2-c22f5fc7afa3,Jordan Lehman,Great concept but one of the worst apps ever. As soon it was installed it said the screen limit was reached making the device completely unusable. When I tried to unlock so I could change settings (just to get setup) it said to check the internet connection. You can't even uninstall the app because to override the uninstall protection you have to...access the internet which this app makes crash. I want to stay safe and this is NOT the way to do it.,1
4709028d-7a9f-47be-bead-b1ed1574eb72,Nicole Schaefer,Getting sick and tired of having my child request access to acceptable websites only to have my child still not able to visit those sights. Updating everything and rebooting systems does nothing. And the locator doesn't find them at all.,1
6eaf1cc8-4e1d-44b9-89cb-23bb42b825ae,Brandon Kerr,This app is absolutely garbage. I have nothing else to say.,1
defc89e9-942a-4739-9fb1-0982ee4b4bde,Mike Brown,"I purchased a 1 year subscription of Mobicip to use on my daughter's Android. Our main goal was to disable the camera, which was easy enough with Mobicip. A nice bonus was being able to track the phone while she was away from the house. An excellent app that did exactly what we needed. Thanks!",5
63a3bcec-6ec2-48ef-bdf3-e8f3cf45bc8a,Doris,I have used this app for around 4 years now. I am able to block specific apps and receive reports regarding the websites my teenagers visit.,5
b0e949b3-6c87-45a7-9a7a-baded2bdf251,Kanthi Adapa,I had abunch if issues when i accepted permission to a website for my kid it just wouldnt work and then my kid tried spamming it.,1
6ad7be7d-46d6-469a-af59-063d37197885,Steve Cook,Great app but cannot sign up and pay for it. great business model! Each time I got for a premium subscription it errors,2
04251612-2704-4917-9d37-551aed3d6fa8,David G,"This app is great for monitoring adult children. I am able to monitor my 18 yr old son w/o applying restrictions (Monitor only). It is great for monitoring my elementary, middle and high school aged kids. We are able to discuss block or questionable websites. Don't be naive and think your children aren't curious and not searching inappropriate things. The android app had glitches and they are now fixed. Mobicip has worked with me to fix that. You can email or schedule a call with them.",5
6844dfa3-2ee3-4b92-8ad5-60d8cd70b5f3,valarie floyd,Sucks,1
41b732c4-174d-4598-9926-7af04e170d29,Slade May,"2 issues, one terrible ui and 2 screen lock is easy to get around. At this point the app fails at its job and it never let's Chrome run however Google requires Chrome to actually run anything. The app is also borderline spyware and I am tempted to call it an intrusive software because it requires administration powers to run",1
2192710f-f54e-42fa-ba48-66eb7673fb42,Zee-Bruh,"It's so bad, I can't even see what I'm doing, do NOT recommend",1
3629cc7e-a04d-4d5f-9470-20606ae40518,Michael Thompson,"The app is OK. It's rather unreliable, much to my kids' frustration. I would give it 3 stars. However I've given it 1 star simply because Mobicip have sent an email asking for 5 star reviews in exchange for Amazon vouchers. This is simply deplorable behaviour. If you want 5 star reviews.... EARN IT BY IMPROVING YOUR APP. UPDATE: I've decided to end this subscription and use Google Family Link which works flawlessly. Absolutely no improvement in over 2 years... Other than a new icon colour.",1
964691e4-40e5-4331-847e-fe24de265dc0,Nicholas Gardner,"Have used it for a few years now, very happy with it. Nothing is perfect, but the app locker option is about as close as you get. Something like this is necessary for responsible parents",5
018c5e22-6d44-4caf-8702-c69a822a9c04,Tracie Hammond,Mobicip was perfect for us. We had a large group of computers and phones used by various ages. Having individual profiles for each kiddo provided the appropriate security for their needs. Highly recommend.,5
d027e35e-2502-4db7-acd4-524a4d76ee82,Claudia Gonzalez,"Great experience! We were able to monitor our kid digital activities, we received weekly activity reports, and give us the peace of mind we needed.",5
3d3de887-002d-416e-8198-373ea3ecabe9,Laura Wilson-Clare,I've set the screen time to when I want but it still doesn't turn my child's device off at the time I've set it to. Very frustrating,1
a239f309-0dc3-40c3-8841-dab89677ca85,Will Johnson,"I've had this installed for 2 days on all my kids devices. They have been able to somehow get past the Screen Time Lock Out. All they have to do is turn the screen off and then log back in and it overrides it!!!??? The system also stops them from being able to uninstall games from their devices which means I have to go in and shut off the App then go back in and turn it back on a just to do so. Not sure if I'm missing something here, but will more then likely cancel this subscription.",1
3110a5ce-4acd-4988-afe5-442b6373e719,Brian Niehoff,Easily bypassed by kids. Nearly worthless,1
e3bb8ad5-fbeb-4bf6-bdd1-830803971925,Jon Brashear,To be honest they say the fixed the issue but the VPN still is causing a ton of connection issues,1
1fd47920-021b-42d8-9c0a-52453573adb8,Kerrie Smith,Only just signed up but seems great so far. I have an android phone and my kids have iPhone 5c's and amazon fire tablets. The app has worked great so far on all these. I will update in a month or so if I feel my review needs updated but so far so good,5
e98eca3f-8980-4d3a-b3b3-2024326e542c,Noureddine Aries,Not free,1
7028ec20-2be4-4ea5-9f60-61b2edb57ac8,Craig van Beek,"Worst app ever, and look out if you want to uninstall it afterwards! We're factory resetting the phone to get rid of it. Doesn't show any websites visited, doesn't show any videos watched. Complete waste of time. Also, the only way to unsubscribe while on trial (yes, of course they take your credit card details first!) is to send them an email/message.",1
57a6c5af-07df-49a0-b5c2-ef8385f55c80,Nancy Dryden,Mobicip worked well for our family and customer services was very responsive.,5
034cfe7e-3f18-4686-94a6-b6a3d54383b3,scientist,Bad,1
2f459059-c4c8-4107-85ad-d3eba9d1e8e5,Gints KÄrkliÅ†Å¡,Be aware that there is no unsubscribe button - only way is to block bank card - looks like scam app,1
4bb5e99d-56ac-4c3e-bcd5-4c678f9c10e1,Pedr Freeman,Dismal..... Don't waste your money on a subscription if you are trying to control your kids use of their Macbooks. It works so rarely and the kids soon work out ways to stop the lock function from functioning (like using their Xbox controller to play the games),1
6e1dcbc2-96fa-46f9-8cdd-3a8e4dca247a,Frank Mallia,Didn't even work and all the options are terrible,1
4633db21-6e6f-429d-8c81-3eda4781f651,Tony Kawaguchi,As of Sep 1 2021- I did 3 reinstalls and it's still super slow on my galaxy s21. It does filter but it has made my internet speed about 10 times slower. Sometimes causes the phone to freeze. It works fine on iPhone but it not great for android.,1
d3430861-042b-40b3-ad50-6014bd70c276,Julie Burns,Great app. Works fast.,5
4fcbb795-5e74-4cc9-9c12-1d3bfcd35cf3,Amber Anderson,Good overall view of smart phone activity. Easy to use & navigate. Great price!,5
47d2cbb6-c7ee-46df-b27c-f49f0bd3f5eb,Daragh Doyle,"Paid for full year subscription. App keeps crashing on both my kids x2 devices, which means it doesn't block apps, websites etc or doesn't deactivate the screen at allocated times. Will look into getting a full refund. Very frustrated.",1
ca51b995-985d-48d9-ad70-d42bedc78030,Andrew Jackson,Rubbish app. Doesn't let you use the Web at all. Always connection error. Total headache. Server is in the USA. And UK sites block it. Don't waste your money,1
f2d2c320-36de-4ce3-9a58-a205691700dc,AbuOmar,"Not working probably, there is no option to cancel subscription unless you request them by email!",2
440f4688-3965-40bc-96a5-e9f837d45139,Tosha Griggs,I do not want this service. This app makes you give card info to start free trial but then makes it impossible to cancel free trial. I have tried contacting the creators to cancel my free tril so i do not get charged and the ditr keeps saying it does not exist. The apo makes it very easy to dybscribe and very hard to cancel. I do not authorize any further payments from my credit card. I revoke all my authorization. If my card gets charged i will report to my bank fraudulant use of my account.,1
fef7deaa-6632-445e-ac6b-668e31bad00c,Scott Wilson,"This is a very good app, especially to install on phones and mobile devices as you start to allow kids to use these devices.",5
f528667c-74e1-45a8-84c9-7f21e8aec1cb,Odell Jakubowski,Good app. It help me manage screen time and monitor all your family devices.,5
c9ec054c-72d1-419a-a145-aa2209aa30c4,Alex,"Works great except that it blocks apps or sites that are marked to be allowed. Facebook and tiktok are allowed but gets blocked all the time. Google? Can't google anything even tho its allowed, but hey it lets you make a request. Does that work no. This app, while nice, is more of a pain then it should be.",1
9999c1f0-2151-482a-a7bb-7467be5d4d7b,Bryan Roberts,"Doesn't work, easy to get around. Don't waste your money.",1
51934564-ad73-4424-8a4c-eb7ba804dda9,Dylan Trainer,"Me and my mom are trying to get rid of it but it wont leave my phone, she's deleted it and restricted it but it just wont leave my phone. It's also blocking every app, even the ones she didnt restrict",1
321566f1-c589-4315-ac7b-ce157a5ebfe0,Adrian Correia,Gps doesn't update live,2
3d64dc5e-2681-416a-8a21-10f4fd644c47,Tamara Lynn,"It's OK but kids can get around it. It notifies you if stuff though so you are a bit in the know. On phone it's hard to admit, I try to add screen time and it doesn't fit screen properly. I add time for whole day and changes can take hour to go into effect even after both parties restart phones. Did update but still some glitches. Needs to be better designed for admin controls on mobile devices.",3
69aa144a-4c75-4b28-b96b-8daad0a7b151,Jennifer Cichosz,Very happy with this app!,5
1a075190-44fd-4a4d-a08c-d19c1ee40da9,r.crossey,I did not want a subscription and have been charged a year's subscription! Please cancel and refund.,1
b9dae83a-4723-4f35-b0ad-e06707c7be6b,GF Marshall,Yet another parental control app plagued with problems. It can't control any Windows based applications and ends up blocking everything. Then there's Google being clogged with blocks. OMG,1
78fb874d-381d-43f1-be8b-a0752276100e,Mandy Hughey,Won't delete from my kids tablet. Keeps locking me out even when I put in the password.,1
3df547f8-65e3-44ee-94fd-802f442f5dcf,Md Asaduzzaman [ SEO Expert ],very good app.,5
5f5d9973-b9a5-41c9-bd3d-9310b622e61d,Ruby Poisson,very good app,5
edfd1c44-9d60-41b3-982b-11f33fe4757d,DesertSoldier43,"My kids can still bypass it, it is stupid. I DO NOT RECOMMEND. It can slow down your child's phone and the app and VPN runs in the background which reduces performance even if you have an OP Phone. Also, it is a safety issue since your kid can't even access messages or phone incase of an emergency. ***Update*** My son came up to me and he said all of his apps are gone, and they were. My sun NEVER lies and I'm not sure if it is because of this app, but all of his apps were gone.",1
13777b79-15b9-46cd-85c8-1dc88967f189,Kevin Bennett,After one day of use I am constantly unlocking the apps on the kids phone only for it to lock them out again. It's a pain and I will likely remove it very soon,1
e978e7c1-8cc7-4c2b-8021-27a45a4dfbf0,B R,I had problems straight away with this app when trying to enter my payment details and it was glitchy then things got worse. I set screentime on my daughter's phone and then tried to extend it but nothing happened - her screen was completely locked and I could not unlock it. Then I tried messaging support but I couldn't submit my message so I gave up and cancelled as fast as I could! I would expect better from free software.,1
34df73ff-b171-4bca-a5d5-d7121f53b0b5,Amber Keiter,"Love the purpose of the app and it works great...beyond great since it doesn't allow my kids to play or use any apps at all. They can't do anything on their internet browser, even the websites I manually added to allowed websites get blocked and won't unblock after accepting a request to be on the certain web pages. Half of the apps my kids have downloaded that they like most they can't play on even though settings allow it. Wish this was fixed so they could still use their kindle with protectio",3
39d7f87a-f296-4957-b434-d101cb2aa758,Jesse Geiger,"While Microsoft Family and Google Family Link work just fine, they are restricted to their own companies. Mobicip bridges the gap by applying the same settings per person on any device it has hbeen installed on. Simple to setup, easy to use, and quite informative on your child's activities, Mobicip has maintained my sanity (for 3 kids) with the knowledge that my children's exposure to ""overt"" and downright dangerous items is significantly reduced. A recommendation for all parents in the digital age.",5
0771be5a-85bb-42ac-8cce-8004c218bb01,Nicolas Standlee,can't complete the install,1
5924fb2c-e554-4708-a23b-6dbf9b1ffe39,Rebecca Fenton,"A year ago, I found my 13 year old daughter had multiple Instagram accounts, and she was doing and saying some pretty bad things on there. I did a bunch of research and found Mobicip. Not gonna lie, I was a tad skeptical, but this ended up being a lifesaver. I was easily able to block apps and websites, and basically shut her phone down to where she could only call/text her dad and I. She had no access to the internet or any other apps. Weâ€™ve only stopped using it because we have iPhones now and I can control her phone that way. I have recommended this app to many many people who still use it to this day. Iâ€™ll continue to recommend even though I am not a current user.",5
a07f8517-fb46-441d-aecd-5757223fa48e,BarlowE,it kepps on blocking me for no reason can you deactivate for me so i can fix,1
48d4c105-310e-46e5-9987-0aa97dc3a140,john hunt,Awful... Just awful,1
76c30efd-4cc8-4d1b-bd07-72709bff11f0,Sarah Musgrave,"Judging from the number of 5 star reviews, apparently when this software works, it works. But my goodnesss, watch out when it doesn't. Dowloaded, paid, and programmed three tablets and linked up two with apps, 'timeout' time etc. I started testing, the spontaneous 'timeout' never worked, so I looked for the FAQ's, nothing on that, then I came to look at the reviews. The developer responses with their dripping sarcasm and condescension convinced me it was not worth trying to support this start up with my business. So determined to cut my losses - 2 hours - of programming kids accounts, I tried to uninstall, thought i was successful one one, but then the other kid's tablets then locked down with countdowns, the first was a two hour countdown, i tried contacting for help, they just told me to go into settings, which can't be done in lockdown. In the end only way to get in is once that count down has stopped and i have just found this morning, two weeks later that the first tablet is now locked down for 5 and a half hours. I fully expect that the charm of the developer might come into play as I post this, but truly. Beware. I work in digital comms, so am not a luddite, and I can't figure this out. And now have deeply unhappy kids and spontaneously locking tablets.",1
4ce02979-f7ee-4ab2-a4c3-7b6a21c5ab35,Nosson Goldstein,Just got new update and finally works on android 11 Thank you,4
1927566f-43c5-4875-99fb-50a4c0ff75ce,Charis Denny,"I was happy when I found this app because there aren't many options for Chromebooks, but I'm becoming increasingly frustrated. It doesn't block the things I want it to block, but then randomly blocks things that I have given my son permission to use. Right now I have the YouTube app turned off in the settings, AND I manually entered youtube into the blocked websites, but youtube opens right up when I click on the app. It just doesn't work the way it's supposed to.",2
61bd0166-e96b-46db-a6f8-18142bce7d5d,Steph Flagg,"Terrible. Overly complicated. And doesn't actually work. When the blocking screen pops up because they're tune blocked, they just close the screen and try again - works fine. Plus, doesn't actually track time on any websites or apps..all days zero. Cancelling.",1
939e01d6-cc98-4044-b6c1-b512d13b8224,Ron Orlando,"Used it for a few months, then the app blocked all internet access. It cannot be uninstalled. Support is useless, you simply get the same instructions from the website, which don't work. Looks like the only option to remove and unbrick the phone is a factory reset. Fingers crossed the admin control of mobicip will let me do that. VTurns your phone into a brick,",1
85c7b6f1-fb34-44d4-955d-c9daf4ab4c0e,Ali Blickenderfer,Awful,1
f352ab71-a3af-4df7-9d1b-c301da76e686,Ian Jones,Found this app very useful for keeping an eye on my little boy from 5 through 12 and his ipad. The reports about what he was searching were a good insight as to his thinking.,5
1936f066-a6be-4192-98ec-a52a64c2ad1b,Jim Babka,"As far as screentime goes, my daughter figured out that if she adjusted the time or date on her phone she could bypass her screentime restrictions. Not a good app.",2
02e489cd-307e-4cc4-9b05-2f1623169a7a,Ashton Nichols,Really...,1
4c1943f3-17e6-4091-b1bc-2690f317857f,Mahmoud Youssef,I tried to contact support team for my problem for 3 days but nobody care to solve it... Actually I am not satisfied at all. The problem is I can't monitor my child's mobile... He has many activities but it is not shown in my mobile,1
bcaa7065-cd9d-4e58-90c5-88580c1b50ba,Brittany FT,Awful app,1
bc6f7a5f-ef24-41b2-bc4d-73106cc1ef95,lydia S.,"I paid for this app months ago, and haven't used it since school let out. my daughter has a newer android track phone and a new hp chromebook now. ive put the mobicip app on both. it seems to be working on her phone but it's not working at all on this chromebook. the parental app on my phone says this device is connected but it's not blocking any apps or websites. i also don't see anywhere to block language and websites anymore, i thought it was on here when i orginially paid for the app.",1
aed25044-2e69-4f01-8e1b-7dc4829ab295,Ashley John-Baptiste,The app is quite thorough but not completely bulletproof.,3
9d3e0fd5-b31f-44b7-8dfa-65ee72630770,Mathew Poon,Piece of junk,1
aa61b0cf-2e79-477e-85cc-788ca8196f5e,C - ST4R!,"Kids don't need fancy up to date phones so was a little surprised it isn't working on Android 4.1.1 - developers are quick to respond and hopefully addressing problem, can't rate until problem is fixed.",2
d0c08a2c-a63a-4050-820b-0d07108ef962,ad vill,Not so accurate. It shows no apps have been used but I look at my daughters phone and she's been on instagram. Also can't see who they're texting,3
890dd8be-ab48-4dc4-a8d1-85e21c838442,Declan Davis,This does not work it barely even gives controll It is always glitching,1
fc3a1c2d-f360-4805-bc1e-735f7c3ebd03,Ammar Ä°dris,Great app with amazing features keep up,5
de2bfb4e-3b25-43ab-b764-69be9a1e4a55,Jaycee Elliott,I (the child) am easily able to turn off all of the permissions without a notification being sent to my parents.,1
f3f3b872-ff11-47fd-9121-3d2e078c4a64,lainie mcktacket,"Horrendous experience! Do not get this app. At the exact second that I soon as I selected apps to time restrict, it deleted all of those apps off my daughter's iPad. 3 emails and 2 days later finally get a call from someone in America on a very sketchy line from a woman that was really hard to hear and understand. After an hour on the phone and lots of repeated restarts and deleting and reinstalling the mobicip app. She tells me that the mobicip app has nothing to do with this. Oh yes it did!",1
3ea834b3-b19c-40d4-a8cb-b1586d502263,Alexander Diaz Hernandez,Thisbisbthe mist retarted app that has ever been installed on any device,1
de52cb1c-5d9f-4155-a644-d44ccd916653,Robert LoGiudice,Software is a turd don't use it.,1
eea29658-21c4-4507-97fd-cf0f5c981f16,sansimator,Bar interface as well as lots of lag. Would recommend any other app,1
